id,title,created,description_from_url,description
565370754,Controller,2017-06-06T15:05:37Z,1,recruit controller join client team belledune nb inaugurate chaleur sawmill organization cut edge technology dynamic group employee complement operation make one efficient company sector chaleur sawmill result dream work four local entrepreneur along group dedicate employee build company inception report directly vice president finance responsible preparation monthly quarterly financial statement reconciliation general ledger account sub ledger monthly support development year end external audit internal process staff management assist preparation annual budget various report ideal candidate year relevant business experience manufacture industry complete cpa designation demonstrate attention detail ability deal effectively efficiently management team player good interpersonal communication skill bilingual french english consider asset interest join client dynamic drive vibrant team apply today express interest opportunity click follow link http job meridiarecruitment ca career careerbeacon careerbeacon post meridia information contact heather labucki senior consultant heather kowalski senior recruitment specialist meridia knightsbridge robertson surrette company atlantic canada lead contingency recruitment firm focus provide high quality fast turnaround recruitment professional technical position information opportunity meridia visit information opportunity parent company knightsbridge robertson surrette visit career information date post may ad number career category employer information halifax city nova scotia halifax city nova scotia halifax city nova scotia halifax city nova scotia halifax city nova scotia similar career moncton new brunswick saint john new brunswick fredericton new brunswick halifax city nova scotia toronto ontario controller job recruit controller join client team belledune nb inaugurate chaleur sawmill organization cut edge technology dynamic group employee complement operation make one efficient company sector chaleur sawmill result dream work four local entrepreneur along group dedicate employee build company inception report directly vice president finance responsible preparation monthly quarterly financial statement reconciliation general ledger account sub ledger monthly support development year end external audit internal process staff management assist preparation annual budget various report ideal candidate year relevant business experience manufacture industry complete cpa designation demonstrate attention detail ability deal effectively efficiently management team player good interpersonal communication skill bilingual french english consider asset interest join client dynamic drive vibrant team apply today express interest opportunity click follow link http job meridiarecruitment ca career careerbeacon careerbeacon post meridia information contact heather labucki senior consultant heather kowalski senior recruitment specialist meridia knightsbridge robertson surrette company atlantic canada lead contingency recruitment firm focus provide high quality fast turnaround recruitment professional technical position information opportunity meridia visit information opportunity parent company knightsbridge robertson surrette visit meridia work location bathurst nb belledune nb publish date may error ok careerbeacon com employer career seeker main street po box moncton nb e1c 8p3 ph careerbeacon com copyright careerbeacon com right reserve careerbeacon com register trademark brunswick news inc
565370913,Accounting Technician,2017-06-06T15:05:37Z,1,account technician job offer halifax regional municipality peverill associate careerbeacon com favourite search create welcome careerbeacon account navigation language search refine category account technician account finance peverill associate halifax regional municipality low sackville nova scotia account technician peverill associate incorporate charter account firm operation since specialize owner operate business perform personal corporate income tax gst account audit business consult immediate open account technician enjoy work small business owner ideal candidate experience sage account system work minimal supervision successful applicant responsible process transaction prepare payroll small business owner reconcile bank account preparation hst return please send cover letter resume click apply button career information date post may ad number at050317 cb career category employer information low sackville nova scotia similar career moncton new brunswick saint john new brunswick fredericton new brunswick halifax city nova scotia toronto ontario account technician job account technician peverill associate incorporate charter account firm operation since specialize owner operate business perform personal corporate income tax gst account audit business consult immediate open account technician enjoy work small business owner ideal candidate experience sage account system work minimal supervision successful applicant responsible process transaction prepare payroll small business owner reconcile bank account preparation hst return please send cover letter resume click apply button peverill associate work location halifax regional municipality n low sackville n publish date may error ok careerbeacon com employer career seeker main street po box moncton nb e1c 8p3 ph careerbeacon com copyright careerbeacon com right reserve careerbeacon com register trademark brunswick news inc
565370801,Bookkeeper,2017-06-06T15:05:38Z,0,outgo capable bookkeepe r interest work within close knit team environment esteem account service provider grow look hire additional bookkeeper assist client account halifax regional municipality area key responsibility bookkeeping portfolio client account system set train corporate tax requirement minimum year full cycle bookkeeping experience post secondary education college
565370786,Payroll & Benefits Coordinator,2017-06-06T15:05:38Z,0,currently seek payroll benefit coordinator permanent opportunity hrm key member dynamic dedicate team responsible full cycle payroll process benefit administration additional account support duty may also require key responsibility verify enter payroll data payroll journal entry reconciliation troubleshoot discrepancy prepare remittance deduction process roe t4 requirement sec
565370806,Accounting Clerk,2017-06-06T15:05:38Z,0,account clerk client seek account clerk south shore nova scotia location opportunity work within busy thrive organization supportive proactive team contract role diverse position focus account receivable account payable account support duty key responsibility client invoice sale entry account reconciliation purchase order invoice match account payable invoice entry cheque run bank reco
565370831,Financial Service Representative,2017-06-06T15:05:38Z,0,easyfinancial provide personal loan since branch across canada lead provider financial product service include unsecured consumer loan prepay card credit repair product cater underserved canadian access product service traditional financial institution financial service representative create superior customer sale experience engage listen underst
565370855,"Analyst, Customer Database (4 months)",2017-06-06T15:05:38Z,1,description assist coach divisional corporate team regard crm process train report include data flow platform structure regularly optimize perform de duplication process guarantee full capacity available platform data refer single customer effectively aggregate respective unique identifier system regularly optimize perform data clean process guarantee full capacity available platform email mail address update free error regularly optimize perform monitor process ensure customer data import respective platform timely manner constantly look identify correct error dataflow customer data integrity flag issue appropriate party follow satisfactory resolution assist coach divisional corporate team regard setup implementation crm research relate initiative contest sweepstakes others assist coach customer care guarantee optimal performance process relate customer database requirement bachelor degree business administration equivalentminimum two three year experience database managementexperience crm marketworks customer service right email exact target platform b2c background retail preferable solid analytical skill detail orientedgood communication skill bilingualism require comment thank applicant select candidate contact career information date post may ad number mtl career category employer information montréal quebec halifax city nova scotia brossard quebec laval quebec boucherville quebec similar career whitby ontario cold lake alberta regina saskatchewan vancouver british columbia barrhead alberta analyst customer database month job description assist coach divisional corporate team regard crm process train report include data flow platform structure regularly optimize perform de duplication process guarantee full capacity available platform data refer single customer effectively aggregate respective unique identifier system regularly optimize perform data clean process guarantee full capacity available platform email mail address update free error regularly optimize perform monitor process ensure customer data import respective platform timely manner constantly look identify correct error dataflow customer data integrity flag issue appropriate party follow satisfactory resolution assist coach divisional corporate team regard setup implementation crm research relate initiative contest sweepstakes others assist coach customer care guarantee optimal performance process relate customer database requirement bachelor degree business administration equivalentminimum two three year experience database managementexperience crm marketworks customer service right email exact target platform b2c background retail preferable solid analytical skill detail orientedgood communication skill bilingualism require comment thank applicant select candidate contact reitmans canada ltd work location montréal qc publish date may error ok careerbeacon com employer career seeker main street po box moncton nb e1c 8p3 ph careerbeacon com copyright careerbeacon com right reserve careerbeacon com register trademark brunswick news inc
565370852,Senior Canadian Tax Specialist,2017-06-06T15:05:38Z,0,senior canadian tax specialist j irving limit large diversify conglomerate base saint john new brunswick employee canada unite state select international jurisdiction operation span forestry transportation retail shipbuilding food agriculture consumer product construction industry look experience corporate tax professional join team locate head office saint john new brunswick re
565370951,Senior Manager,2017-06-06T15:05:38Z,1,many world class account firm far few offer culture rich professional opportunity personal fulfillment long term growth bdo understand exceptional service client begin end exceptional regard people core business number spreadsheet dollar penny people work service others short relationship matter position summary halifax office currently recruit senior manager individual use knowledge advisory skill effectively grow client portfolio relationship senior manager assurance account oversee assurance non assurance engagement deliverable directly relate client engagement accordance firm professional standard development knowledge experience senior manager increase responsibility accountability staff development supervision engagement key accountability responsibility apply relevant technical knowledge technical issue arise client engagement ensure issue address appropriately document accordance appropriate professional standard firm policy apply appropriate industry business knowledge anticipate identify address issue relevant client business apply effective market sell skill develop portfolio new client begin develop build new business opportunity exist client continually maintain positive client relationship periodic visit client site require complete detail review assurance non assurance engagement assurance account project ensure engagement project accordance relevant professional standard firm policy conduct assist others engagement team research necessary technical matter relate client situation conduct provide input staff performance review develop skill capability potential le experience staff supervision coach mentor knowledge transfer internal train delivery assignment challenge work opportunity effectively manage focus firm resource apply appropriate industry business knowledge anticipate identify address issue relevant client business effectively plan supervise execute assurance non assurance engagement assurance account project accordance relevant professional standard account assurance quality control ethical standard firm policy maintain proficiency account assurance quality control ethical standard applicable client base include recent change standard manage efficient completion assurance non assurance engagement assurance account project within require budget deadline without sacrifice quality participate interview assist selection new talent recruitment period provide technical project management leadership skill team member assurance non assurance engagement audit review compilation special report etc assurance account project assurance account project may include preparation financial statement due diligence procedure service relate capital raise involvement tax service provide assurance non assurance client work independently special assignment difficult corporate tax assignment accord business need education professional skill knowledge year professional experience public account assurance role professional designation require ca cma cga cpa advance account audit tax skill experience caseware caseview taxprep asset highly organize effective co coordinator ability deal pressure work flexible hour multi task excellent write verbal communication skill ability deal conflict resolution experience leader strong team build coach skill commit go professional growth development proficiency microsoft office computer program excel word role require regular travel office client site increase frequency depend client client need ability prioritize workload manage multiple task deadline act leader firm continually focus employee engagement complete additional ad hoc duty assignment require high value teamwork client service professionalism support vision firm ensure demonstration bdo value expectation apply interest explore excite career opportunity please apply submit cover letter resume career link website equal opportunity employer would like thank candidate apply select interview contact vision one firm engage make difference value relationship people client community career information date post may ad number mb1705030486 career category employer information st john newfoundland labrador halifax city nova scotia halifax city nova scotia similar career moncton new brunswick saint john new brunswick fredericton new brunswick halifax city nova scotia toronto ontario senior manager job many world class account firm far few offer culture rich professional opportunity personal fulfillment long term growth bdo understand exceptional service client begin end exceptional regard people core business number spreadsheet dollar penny people work service others short relationship matter position summary halifax office currently recruit senior manager individual use knowledge advisory skill effectively grow client portfolio relationship senior manager assurance account oversee assurance non assurance engagement deliverable directly relate client engagement accordance firm professional standard development knowledge experience senior manager increase responsibility accountability staff development supervision engagement key accountability responsibility apply relevant technical knowledge technical issue arise client engagement ensure issue address appropriately document accordance appropriate professional standard firm policy apply appropriate industry business knowledge anticipate identify address issue relevant client business apply effective market sell skill develop portfolio new client begin develop build new business opportunity exist client continually maintain positive client relationship periodic visit client site require complete detail review assurance non assurance engagement assurance account project ensure engagement project accordance relevant professional standard firm policy conduct assist others engagement team research necessary technical matter relate client situation conduct provide input staff performance review develop skill capability potential le experience staff supervision coach mentor knowledge transfer internal train delivery assignment challenge work opportunity effectively manage focus firm resource apply appropriate industry business knowledge anticipate identify address issue relevant client business effectively plan supervise execute assurance non assurance engagement assurance account project accordance relevant professional standard account assurance quality control ethical standard firm policy maintain proficiency account assurance quality control ethical standard applicable client base include recent change standard manage efficient completion assurance non assurance engagement assurance account project within require budget deadline without sacrifice quality participate interview assist selection new talent recruitment period provide technical project management leadership skill team member assurance non assurance engagement audit review compilation special report etc assurance account project assurance account project may include preparation financial statement due diligence procedure service relate capital raise involvement tax service provide assurance non assurance client work independently special assignment difficult corporate tax assignment accord business need education professional skill knowledge year professional experience public account assurance role professional designation require ca cma cga cpa advance account audit tax skill experience caseware caseview taxprep asset highly organize effective co coordinator ability deal pressure work flexible hour multi task excellent write verbal communication skill ability deal conflict resolution experience leader strong team build coach skill commit go professional growth development proficiency microsoft office computer program excel word role require regular travel office client site increase frequency depend client client need ability prioritize workload manage multiple task deadline act leader firm continually focus employee engagement complete additional ad hoc duty assignment require high value teamwork client service professionalism support vision firm ensure demonstration bdo value expectation apply interest explore excite career opportunity please apply submit cover letter resume career link website equal opportunity employer would like thank candidate apply select interview contact vision one firm engage make difference value relationship people client community bdo canada head office work location halifax city n publish date may error ok careerbeacon com employer career seeker main street po box moncton nb e1c 8p3 ph careerbeacon com copyright careerbeacon com right reserve careerbeacon com register trademark brunswick news inc
565370769,Purchase Order Administrator (9 months),2017-06-06T15:05:38Z,1,description create purchase order vendor style unit order product manager global source specialist verify purchase requisition specification price inco term compare item request master list clarify unclear item recommend alternative follow standard operate procedure instruction base international rule regulation requirement college degree international trade equivalentstrong computer knowledge m officeexcellent organizational skillsstrong detail orientationexcellent communicationability work effectively team environment self motivate result orientedprocess procedure orientedbasic international trade knowledge require ensure accuracy aspect business require french english comment thank applicant select candidate contact career information date post june ad number mtl career category employer information montréal quebec halifax city nova scotia brossard quebec laval quebec boucherville quebec similar career moncton new brunswick cornwall prince edward island saint john new brunswick fredericton new brunswick halifax city nova scotia purchase order administrator month job description create purchase order vendor style unit order product manager global source specialist verify purchase requisition specification price inco term compare item request master list clarify unclear item recommend alternative follow standard operate procedure instruction base international rule regulation requirement college degree international trade equivalentstrong computer knowledge m officeexcellent organizational skillsstrong detail orientationexcellent communicationability work effectively team environment self motivate result orientedprocess procedure orientedbasic international trade knowledge require ensure accuracy aspect business require french english comment thank applicant select candidate contact reitmans canada ltd work location montréal qc publish date june error ok careerbeacon com employer career seeker main street po box moncton nb e1c 8p3 ph careerbeacon com copyright careerbeacon com right reserve careerbeacon com register trademark brunswick news inc
565370914,Financial Analyst Specialist,2017-06-06T15:05:39Z,1,job title financial analyst specialistjob description role key team member monthly quarterly annual financial plan analysis process work closely senior operation personnel develop deliver report solution support business well provide informal leadership guidance coach analyst provide informal leadership guidance coach analyst direct review monthly quarterly annual deliverable business finance leadership partner business improve process forecast budget depth ad hoc analysis cultivate relationship business counterpart provide expertise support financial matter operational leadership team education bachelor degree business administration finance account graduate program professional designation asset e g cpa cfa mba experience qualification â year finance account project engineer experience analytical think advance finance account advance financial budget plan report advance financial system process technology advance strong verbal write communication skill must able maintain good work relationship partner well operation strong knowledge m office application particularly excel powerpoint must posse strong analytical skill detail orient must able manage multiple task time job requirement work experience job requirement education location saint john nb career information date post june ad number r103893 career category employer information saint john new brunswick saint john new brunswick st john newfoundland labrador saint john new brunswick saint john new brunswick similar career moncton new brunswick saint john new brunswick fredericton new brunswick halifax city nova scotia toronto ontario financial analyst specialist job job title financial analyst specialistjob description role key team member monthly quarterly annual financial plan analysis process work closely senior operation personnel develop deliver report solution support business well provide informal leadership guidance coach analyst provide informal leadership guidance coach analyst direct review monthly quarterly annual deliverable business finance leadership partner business improve process forecast budget depth ad hoc analysis cultivate relationship business counterpart provide expertise support financial matter operational leadership team education bachelor degree business administration finance account graduate program professional designation asset e g cpa cfa mba experience qualification â year finance account project engineer experience analytical think advance finance account advance financial budget plan report advance financial system process technology advance strong verbal write communication skill must able maintain good work relationship partner well operation strong knowledge m office application particularly excel powerpoint must posse strong analytical skill detail orient must able manage multiple task time job requirement work experience job requirement education location saint john nb irving oil limit work location saint john nb publish date june error ok careerbeacon com employer career seeker main street po box moncton nb e1c 8p3 ph careerbeacon com copyright careerbeacon com right reserve careerbeacon com register trademark brunswick news inc
565371058,Bookkeeper (Construction),2017-06-06T15:05:39Z,0,position title bookkeeper account payable account receivable salary range negotiable client role client establish general contractor woodbridge office hunt experience bookkeeper p r management role report senior operation executive pay yr look may start key responsibility role include account payable process match purchase order invoice ide
565370936,"Vice President, Business Growth",2017-06-06T15:05:40Z,0,opportunity nb onb new brunswick lead business development corporation work company inside outside province drive economic growth job creation province nimble result drive client centric organization onb crown corporation strategically lead private sector board director make business leader new brunswick company academia onb belief strongly future new brunswick since inception april
