id,title,created,description_from_url,description
568131463,Accounting Clerk,2017-06-09T18:40:33Z,0,hickman automotive group one top company atlantic canada vote progress magazine look account clerk join team hickman chevrolet cadillac st john primary duty position include account inventory purchase collect remit payment motor vehicle registration daily post vehicle transfer within hickman automotive group assist management team various month end procedure fill sale rece
568131488,Financial Planning Associate,2017-06-09T18:40:33Z,0,position purpose financial plan associate provide value add sale support responsive value base client contact team financial planner responsible help meet unit team sale objective contribute differentiate client experience make rbc easy business collaborate partner across organization identify meet client need goal key accountability successful applicant ability
568131494,Financial Planning Associate,2017-06-09T18:40:35Z,0,position purpose financial plan associate provide value add sale support responsive value base client contact team financial planner responsible help meet unit team sale objective contribute differentiate client experience make rbc easy business collaborate partner across organization identify meet client need goal key accountability successful applicant ability
568131591,"Officer, Order Acceptance Process Compliance",2017-06-09T18:40:36Z,0,officer accountable effective timely review resolution order defect create recognize induction site mailing commercial customer work effectively commercial service representative sale credit analyst operation community andoa process owner resolve order defect accordance order acceptance oa process corporate business practice policy procedure officer provide guidance leadership supervi
568131492,Customer Assistance Officer - RBC Insurance,2017-06-09T18:40:36Z,0,purpose rbc field sale insurance store offer client ability obtain insurance advice qualify insurance advisor person basis within branch well mobile environment customer assistance officer act first point contact greet incoming customer monitor customer traffic ensure wait time keep minimum primary responsibility put client first ensure excellent customer service deliver first point contact
568131634,Financial Analyst,2017-06-09T18:40:40Z,0,position purpose objective financial analyst work closely manager provide financial report analysis leader enterprise service team perform month end close process support internal client address resolve expense issue perform month end close validate monthly journal entry reconciliation intercompany transaction support coordination consolidation plan budget forecast process across e finance team external clie
568131837,Senior Systems Integration Business Analyst,2017-06-09T18:40:44Z,1,employee group regular full time standard job description participate customer formulate implement enterprise wide business organization information technology strategy work customer help conceptualize mean apply information technology strategic asset involve process design deliver integrate business information solution support enterprise accomplishment business goal specific job description lockheed martin enterprise business service sap senior business analyst part support team lockheed martin canada sap system analyst responsible sustainment activity relate finance module include daily customer support financial report problem analysis resolution prioritization break fix incident functional test documentation train update position work business technical personnel ensure integration interfacing system process need senior level position require interaction global account lm canada chief financial officer cfo position also responsible support identification project issue risk provide status update support stakeholder team dynamic fast pace environment responsibility include successfully take interpret functional system requirement end user document communicate eb technical team create execute effective test plan provide train documentation end user role require work multiple task simultaneously learn new functionality quickly position also include successfully perform operation maintenance function support financial process report role need available call support need position responsible comply lm canada change control process prefer location ottawa kanata base lockheed martin facility travel require support program position require canadian citizenship feasible role provide remote support u uk sap instance direct basic qualification desire skill basic qualification demonstrate experience sap ecc system implementation sustainment experience sap financials focus account process e financial report asset management bill periodic close experience analysis use account rule practice e general ledger balance sheet month end process sap configuration experience finance account certification sap demonstrate ability negotiate challenge issue deliver innovative solution desire skill senior level work experience international finance process cost account bill report labor account asset management demonstrate experience sox audit compliance process prove experience m office product excel word power point prove ability work well virtual team fast pace environment prove self starter excellent interpersonal skill prove experience software development life cycle demonstrate excellent verbal write communication skill strong customer service orientation autoreqid career information date post june ad number career category employer information montréal quebec ottawa ontario montréal quebec ottawa ontario calgary alberta similar career moncton new brunswick saint john new brunswick fredericton new brunswick halifax city nova scotia truro nova scotia senior system integration business analyst job employee group regular full time standard job description participate customer formulate implement enterprise wide business organization information technology strategy work customer help conceptualize mean apply information technology strategic asset involve process design deliver integrate business information solution support enterprise accomplishment business goal specific job description lockheed martin enterprise business service sap senior business analyst part support team lockheed martin canada sap system analyst responsible sustainment activity relate finance module include daily customer support financial report problem analysis resolution prioritization break fix incident functional test documentation train update position work business technical personnel ensure integration interfacing system process need senior level position require interaction global account lm canada chief financial officer cfo position also responsible support identification project issue risk provide status update support stakeholder team dynamic fast pace environment responsibility include successfully take interpret functional system requirement end user document communicate eb technical team create execute effective test plan provide train documentation end user role require work multiple task simultaneously learn new functionality quickly position also include successfully perform operation maintenance function support financial process report role need available call support need position responsible comply lm canada change control process prefer location ottawa kanata base lockheed martin facility travel require support program position require canadian citizenship feasible role provide remote support u uk sap instance direct basic qualification desire skill basic qualification demonstrate experience sap ecc system implementation sustainment experience sap financials focus account process e financial report asset management bill periodic close experience analysis use account rule practice e general ledger balance sheet month end process sap configuration experience finance account certification sap demonstrate ability negotiate challenge issue deliver innovative solution desire skill senior level work experience international finance process cost account bill report labor account asset management demonstrate experience sox audit compliance process prove experience m office product excel word power point prove ability work well virtual team fast pace environment prove self starter excellent interpersonal skill prove experience software development life cycle demonstrate excellent verbal write communication skill strong customer service orientation autoreqid lockheed martin work location ottawa publish date june error ok careerbeacon com employer career seeker main street po box moncton nb e1c 8p3 ph careerbeacon com copyright careerbeacon com right reserve careerbeacon com register trademark brunswick news inc
568214051,Supervisor-Disability Management,2017-06-09T22:03:12Z,1,north york base insurance financial service organization seek supervisor oversee team case manager handle disability claim must least year supervisory experience mentor coach team well extensive experience adjudicate short long term disability claim excellent leadership skill superior speak write english communication skill must want job like subscribe email address submit revoke consent email time continue agree monster job summary location toronto job type full time employee salary year7 bonus potential great benefit post day ago industry insurance view info view le info company company name careerview inc job careerview inc find job email job close email email send note email address use mail delivery job high contrast version copyright monster worldwide u patent b1 v copyright monster worldwide u patent b1 v
568214142,Benefits Coordinator,2017-06-09T22:03:17Z,1,id account permanentlocation city ab edmontonregion edmonton areajob type permanentrecruiter name stephanie rodenkirchen apply please submit resume word format directly stephanie rodenkirchen call stephanie opportunity client immediately look benefit coordinator assist dynamic payroll benefit team locate central west edmonton role report corporate payroll manager must excellent knowledge major benefit provider exceptional communication customer service skill look forward hear key account responsibility functionsensure accurate handle process employee enrolment termination change etc program communicate employee benefit coverage change outstanding paperwork ongoing requirement conduct benefit cost utilization analysis develop communication material promote benefit plan employee reconcile process t4a benefit require skill qualifications2 year experience manage benefit program preferably high pace high volume environment knowledge legislation pertain benefit program ability prioritize work effectively pressure meet deadline ability maintain high level accuracy strong attention detail prove ability flexible confident self motivate compensation benefit base salary accompany comprehensive benefit plan please quote job reference apply please submit resume word format directly stephanie rodenkirchen call stephanie executrade one large comprehensive full service recruitment firm western canada division location edmonton calgary vancouver year experience help client company candidate achieve business goal vision success due people strong relationship build continuous robust evaluation refine recruitment staff process individual interest employment opportunity must obtain necessary approval government canada citizenship immigration department prior apply position accordance canadian immigration law priority give canadian citizen permanent resident canada employment opportunity detail information obtain want job like subscribe email address submit revoke consent email time continue agree monster job summary location edmonton ab job type full time employee post day ago industry financial service career level experience non manager reference code view info view le info follow company company executrade consultant ltd executrade one large comprehensive full service recruitment firm western canada division location edmonton calgary vancouver almost year experience help candidate company achieve goal vision success due people strong relationship build continuous robust evaluation refine recruitment staff process candidate care understand take help find right organization fee job seeker service consider much client organization work carefully review résumé submit u ensure find best fit candidate client executrade recruit specialist job executrade consultant ltd find job enter email address receive job like close email address revoke consent email time continue agree monster email job close email email send note email address use mail delivery job high contrast version copyright monster worldwide u patent b1 v copyright monster worldwide u patent b1 v
568214204,FINANCIAL ANALYST - BUSINESS ANALYST,2017-06-09T22:03:19Z,1,position title financial analyst business analystjob category finance accountingindustry automotive plastic rubber partslocation tilbury ondate june order number company client multi national manufacturer wide variety automotive part addition overseas location several plant locate canada u client offer comprehensive compensation package ongoing train development company benefit health program attribute success diverse competent team innovative box thinker want reach full potential combine opportunity major corporation environment familiar opportunity currently search senior business financial analyst play key role financial management plant operation position description successful applicant provide perceptive financial analysis cost projection effective decision make risk assessment develop build maintain predictive dynamic financial model identify evaluate cause effect relationship viable alternative use sap masis masap map business warehouse excel improve quality efficacy timeliness financial report various department translate complex financial data meaningful analysis insightful recommendation develop maintain continuously improve internal control protect resource detect eliminate error misuse asset assist plant controller month end result include preparation sale bridge journal entry account analysis reconciliation mar report etc review sale forecast detect variance develop action plan experience order competitive position professional account designation cpa cma ca cga year experience automotive manufacture environment advance work knowledge excel experience use sap r3 similar erp system understand mainframe drive standard cost mrp system excellent analytical organizational skill excel deadline drive environment note application meet requirement may acknowledge compensation degree account business employment type permanent full timerequired travel nonerelocation assistance nomanages others nocontact reg shortt p eng cpchow apply please click apply button locate elsewhere job post prefer email resume along answer follow question learn recruiter reg shortt question many year experience business analyst financial analyst automotive manufacture environment level experience use advance technique excel many year experience use sap sap erp system work many year many year experience use standard cost mrp system current recent salary much bonus cash incentive earn past year stoakley stewart consultant stoakley stewart consultant ltd executive search recruit firm international reach open door grow one successful employment agency canada boast person year recruit expertise house team top notch consultant act subject matter expert choose field result provide professional recruit service client candidate variety industry expansive breadth experience allow u firm satisfy hire employment need accordance canadian law policy stoakley stewart consultant consider qualify individual available position without regard race colour religion sexual orientation country origin age disability etc see open job know help help talented professional secure new excite reward career opportunity treat unique individual professionalism respect integrity meet distinct need match right corporate culture also visit u follow u website linkedin twitter stoakleystewart facebook youtube want job like subscribe email address submit revoke consent email time continue agree monster job summary location tilbury job type full time employee post day ago industry staff employment agency career level student high school reference code view info view le info company company name stoakley stewart consultant ltd job stoakley stewart consultant ltd find job enter email address receive job like close email address revoke consent email time continue agree monster email job close email email send note email address use mail delivery job high contrast version copyright monster worldwide u patent b1 v copyright monster worldwide u patent b1 v
568214195,Revenue Coordinator,2017-06-09T22:03:21Z,1,revenue coordinator monster com revenue coordinator hay ottawa job revenue coordinator job work downtown ottawa make work grow property management firm new company client lead commercial real estate business operate throughout canada focus three distinct segment real estate include development construction property management specialize lease management commercial real estate property offer year industry expertise help secure spot top industry leader new role revenue coordinator report directly controller company main focus role handle bill budget lease phone communication tenant revenue coordinator also oversee inputting lease handle account receivable bill issue might arise busy role require individual perform variety different task daily basis need succeed previous experience similar role within commercial property management industry lead success strong attention detail able multi task handle high volume data get along well tenant problem explain complex bill issue need house expert generally comfortable phone ability read interpret commercial real estate lease formal education account background asset experience yardi also asset get return reward great work environment people love come work perform best gain valuable experience one canada top well know commercial real estate firm salary come around overall package include great vacation benefit need interest role click apply forward date copy cv call u job quite right look new position please contact u confidential discussion career want job like subscribe email address submit revoke consent email time continue agree monster job summary location ottawa job type full time employee salary year post day ago industry real estate property management account audit service career level entry level reference code view info view le info contact information contact name ibrahim saab company company name hay job hay find job email job close email email send note email address use mail delivery job high contrast version copyright monster worldwide u patent b1 v copyright monster worldwide u patent b1 v
568214274,Int-Sr Accountant,2017-06-09T22:03:30Z,1,progressive grow well know charter professional accountant firm vaughan broad client base require senior intermediate accountant client consist people offer service assurance advisory forensics tax valuation firm also provide monitor service many small account firm host professional development course cpa area firm offer work life balance many opportunity advancement trait successful candidate include good ability multi taskbe able work independently othersthe candidate also able supervise junior staff able delegate part responsibilitiesthe candidate must work towards cpa designation qualification include year experienceproficient caseware caseview tax prep microsoft officemust pass exam cfe passmust earn least assurance hour want job like subscribe email address submit revoke consent email time continue agree monster job summary location vaughan job type full time employee post day ago industry account audit service career level experience non manager reference code view info view le info find job email job close email email send note email address use mail delivery job high contrast version copyright monster worldwide u patent b1 v copyright monster worldwide u patent b1 v
568214293,"Sr Manager, Treasury",2017-06-09T22:03:30Z,1,client locate downtown toronto near union station currently create new treasury dept grow organization select candidate instrumental create policy procedure ensure efficiency responsibility include lead day day management treasury function business ensure optimization cash management process across mandate maintain relationship bank brokerage partner manage line credit cash forecast review approve bank recs wire transfer eft bank transfer fx transactionsto consider role candidate must meet follow qualification year experience treasury year leadership experience cpa ctp mba prefer strong communication skill ability flexible adaptable change high stress environmentif sound like fit please apply today natalie ravinaphone number number canada commit foster inclusive accessible environment employee customer feel value respect support dedicate build workforce reflect diversity customer community live serve create environment every employee opportunity reach potential welcome application woman aboriginal person person disability ethnic minority visible minority others may contribute diversification part commitment accessibility person disability randstad canada upon request applicant provide accommodation recruitment process ensure equal access applicant disability please contact randstad recruiter consultant need consult ensure suitable accommodation provide qualify applicant encourage apply however accordance canadian immigration requirement canadian permanent resident give priority feedback equity accommodation need please contact local randstad canada branch want job like subscribe email address submit revoke consent email time continue agree monster job summary location toronto job type full time temporary contract project post day ago industry staff employment agency reference code view info view le info company company name randstad job randstad find job revoke consent email time continue agree monster email job close email email send note email address use mail delivery job high contrast version copyright monster worldwide u patent b1 v copyright monster worldwide u patent b1 v
568214369,Cash Applications,2017-06-09T22:03:35Z,1,client north american leader toronto area look add cash application professional team role permanent full time position report controller role locate toronto area key responsibility daily post eft ach wire cheque edi payment large volume fast pace environment control administrate unapplied payment prepare daily cash report unapplied cash relate reports4 investigate application post discrepancies5 responsible daily bank deposit maintain control report payment apply day receipt7 back others team period absence high work volume8 general file correspondence9 build strengthen work relationship support team minimum year experience cash application high volume environment strong computer skill m office intermediate advance excel skills3 experience vms reconciliation asset excellent communication skill verbal written5 accpac experience asset want job like subscribe email address submit revoke consent email time continue agree monster job summary location toronto job type full time employee post day ago career level experience non manager company company name rywick recruitment job rywick recruitment find job email job close email email send note email address use mail delivery job high contrast version copyright monster worldwide u patent b1 v copyright monster worldwide u patent b1 v
