id,title,created,description_from_url,description
568128964,Controller,2017-06-09T18:39:34Z,1,currently seek controller permanent opportunity dartmouth candidate adaptable drive eager learn great fit role member senior management team primary focus oversee small dedicate account team perform account duty within thrive organization key responsibility journal entry gl maintenance month end analysis financial statement preparation cash flow management ap ar payroll entry review year end audit preparation staff supervision requirement post secondary education focus account cpa complete progress equivalent experience minimum year full cycle account experience strong technical account skill self motivate eager take initiative excellent interpersonal skill interest position please forward resume attention carmen dockendorff email please quote position as13224 cb thank candidate interest however select interview contact accountant staff atlantic canada specialist recruitment firm focus exclusively placement account finance professional organization use service accountant staff fill variety role junior accountant chief financial officer information accountant staff view additional position please visit website career information date post june ad number as13224 cb career category employer information halifax city nova scotia dartmouth nova scotia halifax city nova scotia halifax city nova scotia kentville nova scotia similar career moncton new brunswick saint john new brunswick fredericton new brunswick halifax city nova scotia truro nova scotia controller job currently seek controller permanent opportunity dartmouth candidate adaptable drive eager learn great fit role member senior management team primary focus oversee small dedicate account team perform account duty within thrive organization key responsibility journal entry gl maintenance month end analysis financial statement preparation cash flow management ap ar payroll entry review year end audit preparation staff supervision requirement post secondary education focus account cpa complete progress equivalent experience minimum year full cycle account experience strong technical account skill self motivate eager take initiative excellent interpersonal skill interest position please forward resume attention carmen dockendorff email please quote position as13224 cb thank candidate interest however select interview contact accountant staff atlantic canada specialist recruitment firm focus exclusively placement account finance professional organization use service accountant staff fill variety role junior accountant chief financial officer information accountant staff view additional position please visit website accountant staff work location dartmouth n publish date june error ok careerbeacon com employer career seeker main street po box moncton nb e1c 8p3 ph careerbeacon com copyright careerbeacon com right reserve careerbeacon com register trademark brunswick news inc
568129299,"Manager, Program Financial Analysis, International Programs",2017-06-09T18:39:42Z,1,employee group regular full time standard job description perform one multiple financial activity within various finance job function compile review budget use actual performance previous budget figure estimate revenue expense report data source control fund provide proper financial administration perform multiple financial cost analysis function include cost allocation set cost control system collect data control cost prepare report maintain company cost account system ensure cost allocate accord establish procedure apply principle account analyze financial information prepare financial report maintain oversee control account record area disbursement expense tax payment income specific job description position fill need management performance model major international program term adhere process require part formal lockheed martin business rhythm individual also much interaction international lob director program manager well finance business operation u rms team term forecast program financial status review position encompass team financial analyst grow area international navy program require good communication skill team geographically disperse within canada basic qualification desire skill bachelor commerce business year program performance management experience pmp designation would asset high level business acumen require position require significant level interaction top program manager senior u rms exec autoreqid career information date post june ad number career category employer information montréal quebec ottawa ontario montréal quebec ottawa ontario calgary alberta similar career st john newfoundland labrador halifax regional municipality nova scotia calgary alberta humboldt saskatchewan burnaby british columbia manager program financial analysis international program job employee group regular full time standard job description perform one multiple financial activity within various finance job function compile review budget use actual performance previous budget figure estimate revenue expense report data source control fund provide proper financial administration perform multiple financial cost analysis function include cost allocation set cost control system collect data control cost prepare report maintain company cost account system ensure cost allocate accord establish procedure apply principle account analyze financial information prepare financial report maintain oversee control account record area disbursement expense tax payment income specific job description position fill need management performance model major international program term adhere process require part formal lockheed martin business rhythm individual also much interaction international lob director program manager well finance business operation u rms team term forecast program financial status review position encompass team financial analyst grow area international navy program require good communication skill team geographically disperse within canada basic qualification desire skill bachelor commerce business year program performance management experience pmp designation would asset high level business acumen require position require significant level interaction top program manager senior u rms exec autoreqid lockheed martin work location ottawa publish date june error ok careerbeacon com employer career seeker main street po box moncton nb e1c 8p3 ph careerbeacon com copyright careerbeacon com right reserve careerbeacon com register trademark brunswick news inc
568129450,Chief Financial Officer,2017-06-09T18:39:45Z,1,behalf client chief financial officer seafood process platform base maritime province cfo key member senior leadership team serve integral part company decision make process bring analytical skill negotiation prowess financial knowledge dynamic company continue grow acquire innovate seafood industry day day basis plan direct control company overall financial plan policy account practice relationship lender financial community oversee account budget tax treasury administrative function include direct preparation financial report include income statement balance sheet report shareholder tax return report government regulatory agency design manage company internal performance management report system develop implement budgetary control system record keep system administrative control process design implement risk management practice require e g interest rate hedge strategy fx strategy etc direct company auditor function ensure linkage finance operation analyze operation pinpoint opportunity area need reorganize direct oversee company controller account payable payroll clerk function work alongside bank professional lawyer accountant etc execute finance acquisition raise additional capital need oversee integration company acquisition target confer company top management coordinate prioritize company plan enable ceo regard finance advise inform regard company financial situation evaluate company employee performance ensure alignment organization objective implement policy objective activity ensure continue operation maximize return investment increase productivity confer organization official staff member discus issue coordinate activity resolve problem implement corrective action plan negotiate contract agreement review prepare present report concern activity expense budget serve liaison organization shareholder board director represent company bank financial partner institution investor public auditor official open travel visit company hold regular basis successful role likely bring advance train account finance professional account designation year progressively increase responsibility financial leadership role experience finance investment experience financial model board investor relationship experience background coordinate staff consultant implement upgrade account system entrepreneurial approach ability make solid business decision bias towards action desire work fast pace environment problem solve manage compete priority exceptional communication presentation skill advance proficiency excel powerpoint seafood industry experience apply please click apply button career information date post june ad number cfo0609 cb career category employer information similar career moncton new brunswick saint john new brunswick fredericton new brunswick halifax city nova scotia truro nova scotia chief financial officer job behalf client chief financial officer seafood process platform base maritime province cfo key member senior leadership team serve integral part company decision make process bring analytical skill negotiation prowess financial knowledge dynamic company continue grow acquire innovate seafood industry day day basis plan direct control company overall financial plan policy account practice relationship lender financial community oversee account budget tax treasury administrative function include direct preparation financial report include income statement balance sheet report shareholder tax return report government regulatory agency design manage company internal performance management report system develop implement budgetary control system record keep system administrative control process design implement risk management practice require e g interest rate hedge strategy fx strategy etc direct company auditor function ensure linkage finance operation analyze operation pinpoint opportunity area need reorganize direct oversee company controller account payable payroll clerk function work alongside bank professional lawyer accountant etc execute finance acquisition raise additional capital need oversee integration company acquisition target confer company top management coordinate prioritize company plan enable ceo regard finance advise inform regard company financial situation evaluate company employee performance ensure alignment organization objective implement policy objective activity ensure continue operation maximize return investment increase productivity confer organization official staff member discus issue coordinate activity resolve problem implement corrective action plan negotiate contract agreement review prepare present report concern activity expense budget serve liaison organization shareholder board director represent company bank financial partner institution investor public auditor official open travel visit company hold regular basis successful role likely bring advance train account finance professional account designation year progressively increase responsibility financial leadership role experience finance investment experience financial model board investor relationship experience background coordinate staff consultant implement upgrade account system entrepreneurial approach ability make solid business decision bias towards action desire work fast pace environment problem solve manage compete priority exceptional communication presentation skill advance proficiency excel powerpoint seafood industry experience apply please click apply button canada inc work location halifax city n publish date june error ok careerbeacon com employer career seeker main street po box moncton nb e1c 8p3 ph careerbeacon com copyright careerbeacon com right reserve careerbeacon com register trademark brunswick news inc
562289037,Bookkeeper wanted for EDI Immigration Consulting Ltd accountingfinance,2017-06-02T04:35:12Z,1,bookkeeper want edi immigration consult ltd accountingfinance ad nr free local classified category buy sell job service car vehicle house pet animal community event free stuff province alberta colombie britannique manitoba nouveau brunswick terre neuve et labrador nouvelle écosse territoires du nord ouest nunavut ontario île du prince édouard québec saskatchewan yukon back bookkeeper want edi immigration consult ltd accountingfinance alberta calgary post thursday june visit offer type offer category comptabilité city calgary bookkeeper want edi immigration consult ltd account technician bookkeeper edi immigration consult ltd calgary ab job detail vacancy job start date soon possible wage hour hour hour week term employment permanent full time work hour employer edi immigration consult ltd skill work condition physical capability tight deadline repetitive task work pressure attention detail work location information urban area personal suitability accurate client focus reliability organize team player business equipment computer application m word quick book m outlook m excel simply account specific skill prepare trial balance book maintain general ledger financial statement post journal entry reconcile account keep financial record establish maintain balance various account use manual computerize bookkeeping system prepare tax return prepare statistical financial account report calculate prepare cheque payroll education college cegep non university certificate diploma program year year experience year le year language english apply mail room centre st nw calgary ab t2e 2s7 email compensation n employment type full time contact poster email wraperr float leave ad similar bookkeeper want edi immigration consult ltd accountingfinance alberta calgary emplois want edi immigration consult ltd account technician bookkeeper calgary emplois bar restos tourismebookkeeper want edi immigration consult ltd account technician bookkeeper whitecourt emplois whitecourt ab salary hourly hour per week skill edmonton emplois comptabilité veteran canadian arm force person disability indigenous register edmonton emplois comptabilité security clearance transportation travel information public transportation detail work sponsor link id ad report ad power
562812553,Actuarial Client Support,2017-06-02T16:42:29Z,1,role responsibility actuarial client support specialist deal directly client daily basis provide actuarial support train advice best practice implement model axis also work documentation client assist research project provide exposure state art actuarial science application real problem client support specialist member client support focus area particular product team primary responsibility help desk primary method handle ad hoc client inquiry use software include help desk assignment least per week must available est acknowledge review prioritize initial call email client research answer client question quickly possible adhere company standard ensure contact client outside acknowledgement within prescribe timeframes general client support also apply help desk responsibility carryovers help desk well direct contact client investigate analyze client question problem require ensure understand client try investigate whether solution already exist within axis discus developer whether new feature may require complex issue work ggy resource assist require keep client inform status investigation may require time determine answer document contact client problem resolution job ir discussion direct client exist explanatory material e g kb help text reconciliation spreadsheet creation additional explanatory material need answer client inquiry help develop business specification new feature new feature deem require serve liaison ggy client determine client importance urgency respect delivery feature ensure ggy understand client business issue feature deliver cover work developer prepare business specification document send specification client approval test new feature bug fix require work developer client give feature bug fix determine formal test plan ensure feature fix function expect perform sign prescribe test feature line release schedule may include develop job specific data use future test qa team conduct house web base site train preparation delivery train specific module topic ensure pre train administrative step complete internal e g send train summary plan client external completion wbt client know audience adjust communication style require responsibility participate interest group work group area interest expertise may include assist research various industry topic assist provide information employee various purpose either ad hoc formal basis client management assist relationship manager client coordinator research client request status direct project work update formal train material need develop explanatory article spreadsheet topic need develop expand sample data delivery software duty assign ggy moody analytics company actuarial software company locate toronto ontario devote develop maintain support ggy axis integrate full feature actuarial software product use canada u around world minimum requirement asa work towards fsa equivalent work experience least year experience life insurance industry canada u client support similar capacity experience life annuity health area price valuation corporate model risk management alm stochastic model work hedge client contact train office travel require client service orient great interpersonal skill effective communication listen question skill ability research information explain clearly presentation skill attention detail ability ass e g diagnose summarise priority need excellent record keep ability adept build maintain relationship wide range people administrative report write skill organisational time management skill include ability meet target confidence group situation moody essential component global capital market provide credit rating research tool analysis contribute transparent integrate financial market moody corporation nyse mco parent company moody investor service provide credit rating research cover debt instrument security moody analytics offer lead edge software advisory service research credit economic analysis financial risk management corporation report revenue billion employ approximately people worldwide maintain presence country information available www moody com moody equal opportunity employer qualify applicant receive consideration employment without regard race color religion sex national origin disability protect veteran status sexual orientation characteristic protect law mi ms candidate ask disclose security holding pursuant moody policy security trade employment contingent upon compliance policy include remediation position holding necessary apply save apply save moody contact detail recruiter ref job like europe middle east africa america asia pacific efinancialcareers contact u link legal information efinancialcareers dhi service dhi publicly trade company list new york stock exchange ticker dhx copyright efinancialcareers ltd term condition update click read use cooky ensure give best experience website continue assume happy receive cooky website use new beta search work progress rely feedback improve find change get good company sector categorisation easy access job sector ability feedback search beta experience get ability set job alert easy opt beta want set job alert return time
570378911,Bookkeeping Accounting Taxation accountingfinance,2017-06-13T15:57:25Z,1,peace mind save time money bilingual english french comprehensive service qualify professional accountant commit meet deadline provide best quality service provide bookkeeping account payroll taxation gst government filing service individual small business self employee partnership sole proprietor contractor quebec taxation set structure business overview financial operation focus run business efficiently personalize service solution business personal account need reply consultation compensation tbn employment type part time contact poster email wraperr float leave ad similar bookkeeping account taxation accountingfinance alberta edmonton emplois comptabilité full cycle bookkeeping month end year edmonton emplois comptabilité full cycle bookkeeping month end year edmonton emplois comptabilité salary description bookkeeping clerk advertise account technician edmonton emplois comptabilité operate sage account system understand edmonton emplois comptabilitéjob title bookkeeping clerk noc prepare statistical financial account report sponsor link id ad report ad power
570426805,Cashiers (NOC 6611) Job,2017-06-13T18:13:18Z,1,job requirement title cashier noc term employment permanent full time day even night weekendskills security safety criminal record checkwork condition physical capability attention detail stand extend period work pressure fast pace environmentspecific skill operate cash register receive payment good service calculate daily shift payment receive reconcile total sale greet customer wrap place merchandise bagpersonal suitability team player certificate licence membership course etc requirededucation secondary high school graduation certificate note ad run day expire september contact information contact name confidential company type company city edmonton state alberta zip job spider
570439465,Accounting Support,2017-06-13T22:20:02Z,0,complete p r month end government remittance procedure complete semi monthly payroll use ceridian quickbooks application assist admission human resource function assist support office variety task include answer phone data entry interact student teacher client daily basis prioritize multiple task professional courteous manner handle sensitive information maturity professionalism requirement
