id,title,created,description_from_url,description
565904575,Electrical Engineer / Oil and Gas Calgary 2057806 Job,2017-06-07T11:17:16Z,1,company offer downhole completion tool service unconventional conventional completion expand line coil tube deploy frac tool corporate office calgary houston service north america assure success bring people top field rapidly grow young company employ invest people across world help develop deliver new technology ever need join team support encouragement room grow undoubtedly make immediate impact career positionreporting r manager plan direct coordinate engineer project client technology center work business development sale operation technical service group develop commercialize exist new product line specific responsibility electrical design downhole tool include power transmission telemetry surface control direct project efficiently cost effectively achieve technical commercial goal validate design engineer calculation participate engineer group solve technical problem work internal external stakeholder establish project specification source evaluate exist industry solution service provider estimate project budget supervise create accurate clear manufacture drawing organize save data pdm software supervise manufacture process timely accurate part assemble test part assembly confirm meet design criterion create supervise ensure safe test procedure follow monitor document analyze test result assist lead field trial new tool procedure support h e programabout p eng engineer train designation require degree electrical engineer prefer min year experience relevant electrical engineer project within oil gas experience canbus spi rs485 prefer experience design specify equipment zone div etc prefer experience csa certification process prefer experience design specify scada equipment prefer experience embed system rtos afe c prefer experience altium pcb design experience prefer experience cad pdm software solidworks enterprise beneficial knowledge computer system software next stepswe encourage qualify candidate consider excellent opportunity please note directly align background contact interview compensation full time permanent role attractive compensation benefit package work life balance perk please apply today keywords electrical engineer electrical engineer electrician electrical project engineer electrical engineer technologist electrical engineer tech p eng engineer engineer canbus spi rs485 csa scada rtos afe c altium pcb solidworks enterprise alberta ab chestermere langdon de winton bragg creek cochrane airdrie strathmore crossfield carstairs black diamond high river okotoks midnapore silver spring canmore banff brook drumheller oil gas contact information contact name net hire company type company city toronto state ontario zip web site job spider
565904590,Autobody technician (NOC: 7322) Job,2017-06-07T11:17:21Z,1,title autobody technician noc vacancy start date soon possiblewage hourhours hour weekterms employment permanent full time dayemployer source solution inc source auto auctionbusiness address job location avenue edmonton alberta t5l 3h3 job requirement skillsown tool equipment steel toe safety bootssecurity safety criminal record checktransportation travel information valid driver licencework condition physical capability fast pace environment physically demand attention detailspecific skill review damage report estimate repair cost plan work perform replace front end component body component door frame underbody component file grind sand body surface repair hammer dent buckle defect use block hammer remove damage fender panel grill bolt weld replacement part place operate solder equipment use plastic filler fill hole dent seam straighten bend frame use frame underbody pull anchor equipmentcredentials certificate licence membership course etc motor vehicle body repairer trade secondary high school graduation year le yearslanguages englishhow applyby email sourcecansol gmail comnote ad run day expire september job criterion start date soon possible position type full time permanent year experience require education require high school overnight travel vacation time contact information contact name source solution inc source auto auction company type employer company source solution inc source auto auction city edmonton state alberta zip job spider
565913206,Junior Mechanical Technologist,2017-06-07T13:44:18Z,0,awc process solution awc process solution along subsidiary awc water solution full service distributor integrator oem industrial process equipment awc specialize provide customer fully integrate turnkey solution house service include advance engineer design model pilot fabrication facility machine shop project management automation control design house panel shop train full range field servic
565913288,Front End Engineer,2017-06-07T13:44:49Z,1,front end engineer key member borrowell engineer team design develop optimize test maintain application code borrowell web mobile application ensure software meet technical business requirement guide design excite role significant involvement application development maintenance help borrowell create simple good way canadian access credit score get affordable loan online requirement strong understand angular x web pack npm gulp front end technology passion create great user experience fluent html cs javascript important quality passion code enjoy apply technical skill solve business problem strive excellence everything develop customer satisfaction process product quality reliability strong communication interpersonal skill positive team player show attention detail excite possibility push technology find new way deliver financial service benefitswhat offer opportunity join help build grow company change face financial service industry provide canadian consumer good finance option flexible hour vacation policy great colleague toot horn much think great people want work great people team smart hardworking fun downtown office location open collaborative workspace employer pay benefit plan cover medical dental extend health benefit application review position fill look forward hear borrowell place high value build diverse team key goal u achieve gender parity live well work well borrowell power
566102649,Combat Systems Specialist,2017-06-07T15:29:06Z,1,combat system specialist irving shipbuilding locate barrington street halifax n b3k 5m7 part j irving group company business build quality ship repair vessel company primary site halifax shipyard three location maritime province irving shipbuilding currently work number significant project department national defense canadian coast guard company commitment health safety care employee environment integral part business permanent full time staff role position base halifax n combat system specialist manage canadian surface combatant csc combat system interface control document report combat management system lead responsible key responsibility ensure combat system element physical functional interface identify define approve via interface control documentsevaluate csc engineer change proposal ecp request deviation wavy determine impact establish combat system interfacesmaintain combat system interface control document current accurateco chair interface control integrate product team minimum qualification relevant post secondary technology engineering5 year experience combat system subsystem interface integration test trials7 year experience engineer programmatic environment year work similar role work integrate product teamexperience work military standard naval shipbuilding industryexperience work major defence contract would consider asset accustom work fast pace environment conflict priority successful applicant must meet requirement canadian control good program cgp canadian government security clearance u international traffic arm regulation itar offer irving shipbuilding proud offer competitive salary benefit package include limit medical dental vision detail please contact emily snow appreciate interest company application receive deadline may consider candidate select interview contact learn product service click irving shipbuilding inc commit principle equal opportunity employment practice provide environment free discrimination harassment employee accept unsolicited resume search firm employment agency responsible fee relate unsolicited resume career information date post june ad number career category employer information halifax city nova scotia halifax city nova scotia halifax city nova scotia halifax city nova scotia halifax city nova scotia similar career flexible quebec nanticoke ontario saint john new brunswick argentia newfoundland labrador halifax city nova scotia combat system specialist job combat system specialist irving shipbuilding locate barrington street halifax n b3k 5m7 part j irving group company business build quality ship repair vessel company primary site halifax shipyard three location maritime province irving shipbuilding currently work number significant project department national defense canadian coast guard company commitment health safety care employee environment integral part business permanent full time staff role position base halifax n combat system specialist manage canadian surface combatant csc combat system interface control document report combat management system lead responsible key responsibility ensure combat system element physical functional interface identify define approve via interface control documentsevaluate csc engineer change proposal ecp request deviation wavy determine impact establish combat system interfacesmaintain combat system interface control document current accurateco chair interface control integrate product team minimum qualification relevant post secondary technology engineering5 year experience combat system subsystem interface integration test trials7 year experience engineer programmatic environment year work similar role work integrate product teamexperience work military standard naval shipbuilding industryexperience work major defence contract would consider asset accustom work fast pace environment conflict priority successful applicant must meet requirement canadian control good program cgp canadian government security clearance u international traffic arm regulation itar offer irving shipbuilding proud offer competitive salary benefit package include limit medical dental vision detail please contact emily snow appreciate interest company application receive deadline may consider candidate select interview contact learn product service click irving shipbuilding inc commit principle equal opportunity employment practice provide environment free discrimination harassment employee accept unsolicited resume search firm employment agency responsible fee relate unsolicited resume irving shipbuilding work location halifax city n publish date june error ok careerbeacon com employer career seeker main street po box moncton nb e1c 8p3 ph careerbeacon com copyright careerbeacon com right reserve careerbeacon com register trademark brunswick news inc
566103001,Commissioning Technician(Montreal),2017-06-07T15:29:10Z,1,whether look permanent contract position cadre hire human resource contact need secure right opportunity comprehensive assessment tool enable u get know identify strength place within organization satisfy career goal email job company company lead single source solution provider food package industry manufacture broad range product engineer manufacture international facility although core product offer customization common achieve customer expectation fast pace dynamic challenge environment perfectly suit individual ambitious enjoy pressure responsibility integral part win team salary annual range plus bonus accord experience role person expect assemble test approve package machinery house travel client location site commission test house report production work manufacture cell production team assemble test approve machinery test machinery real time application simulation ensure contractual expectation meet complete sign documentation client presence manage factory acceptance test fat provide secondary phone online technical support commission travel report service manager travel client facility provide start train time field service expect average travel mostly consist monday friday include classroom operator production maintenance train oversee client production personnel run production adjust potential issue may arise travel mostly usa contribution define term technical acumen creativity adjust machinery meet client application expectation productive quality conscious deliver machine time properly will put client first complete job even additional hour time require flexible easy manage dynamic environment provide feedback improvement evolution product require skill strong knowledge pneumatics plc servo vfd mechanical assembly electrical assembly year experience manufacture engineer environment year pertinent experience travel service representative ability read electrical schematic troubleshoot valid driver license canadian citizenship ability travel unite state abroad minimum dep u travel excellent command english require career information date post june ad number a0x0w000005k5ljqas career category employer information montréal quebec stoney creek ontario edmonton alberta montréal quebec montréal quebec similar career flexible quebec nanticoke ontario saint john new brunswick brampton ontario st john newfoundland labrador commission technician montreal job whether look permanent contract position cadre hire human resource contact need secure right opportunity comprehensive assessment tool enable u get know identify strength place within organization satisfy career goal email job company company lead single source solution provider food package industry manufacture broad range product engineer manufacture international facility although core product offer customization common achieve customer expectation fast pace dynamic challenge environment perfectly suit individual ambitious enjoy pressure responsibility integral part win team salary annual range plus bonus accord experience role person expect assemble test approve package machinery house travel client location site commission test house report production work manufacture cell production team assemble test approve machinery test machinery real time application simulation ensure contractual expectation meet complete sign documentation client presence manage factory acceptance test fat provide secondary phone online technical support commission travel report service manager travel client facility provide start train time field service expect average travel mostly consist monday friday include classroom operator production maintenance train oversee client production personnel run production adjust potential issue may arise travel mostly usa contribution define term technical acumen creativity adjust machinery meet client application expectation productive quality conscious deliver machine time properly will put client first complete job even additional hour time require flexible easy manage dynamic environment provide feedback improvement evolution product require skill strong knowledge pneumatics plc servo vfd mechanical assembly electrical assembly year experience manufacture engineer environment year pertinent experience travel service representative ability read electrical schematic troubleshoot valid driver license canadian citizenship ability travel unite state abroad minimum dep u travel excellent command english require cadre work location montréal qc publish date june error ok careerbeacon com employer career seeker main street po box moncton nb e1c 8p3 ph careerbeacon com copyright careerbeacon com right reserve careerbeacon com register trademark brunswick news inc
566102993,Métallurgiste,2017-06-07T15:29:11Z,1,whether look permanent contract position cadre hire human resource contact need secure right opportunity comprehensive assessment tool enable u get know identify strength place within organization satisfy career goal email job métallurgiste comme ingénieur métallurgiste vous savez créer implanter et mettre à jour un système de connaissances pour le opérations de transformation de l usine et en résoudre le problèmes technique qui pourraient en découler vous gérez vos ressources et vos activités dans un contexte amélioration continue vous permettant optimiser le opérations de réduire le coûts et augmenter la productivité vous gérez vos budget et le indicateurs de performance et collaborez étroitement avec le autres service de l entreprise le milieu industriel vous fascine et aimez être au c ur de opérations et de l action responsabilités réaliser de projets amélioration de la qualité et ou de procédés résoudre le problèmes de qualité en mettant en place de plan action efficaces améliorer la qualité du produit pour atteindre le nouvelles exigences de client assurer que le projets amélioration soient bien documentés fournir le soutien technique aux opérations pour résoudre de problèmes de nature technique implanter de nouvelles pratiques opérationnelles assurer un enregistrement efficace de données de production et de changements de procédés former le personnel de production mettre en service de nouveaux équipements et de nouveaux procédés puis en assurer la fiabilité qualification diplôme universitaire en génie de matériaux ou génie chimique années expérience en industrie dans le secteur pertinent expérience dans le secteur en industrie lourde aluminium mine et ou aciermicrosoft office excel word powerpoint m project leadership mobilisateur et agent de changement maîtrise de la langue française et anglaise career information date post june ad number a0xd0000004nyazaay career category employer information montréal quebec stoney creek ontario edmonton alberta montréal quebec montréal quebec similar career flexible quebec nanticoke ontario saint john new brunswick argentia newfoundland labrador halifax city nova scotia métallurgiste job whether look permanent contract position cadre hire human resource contact need secure right opportunity comprehensive assessment tool enable u get know identify strength place within organization satisfy career goal email job métallurgiste comme ingénieur métallurgiste vous savez créer implanter et mettre à jour un système de connaissances pour le opérations de transformation de l usine et en résoudre le problèmes technique qui pourraient en découler vous gérez vos ressources et vos activités dans un contexte amélioration continue vous permettant optimiser le opérations de réduire le coûts et augmenter la productivité vous gérez vos budget et le indicateurs de performance et collaborez étroitement avec le autres service de l entreprise le milieu industriel vous fascine et aimez être au c ur de opérations et de l action responsabilités réaliser de projets amélioration de la qualité et ou de procédés résoudre le problèmes de qualité en mettant en place de plan action efficaces améliorer la qualité du produit pour atteindre le nouvelles exigences de client assurer que le projets amélioration soient bien documentés fournir le soutien technique aux opérations pour résoudre de problèmes de nature technique implanter de nouvelles pratiques opérationnelles assurer un enregistrement efficace de données de production et de changements de procédés former le personnel de production mettre en service de nouveaux équipements et de nouveaux procédés puis en assurer la fiabilité qualification diplôme universitaire en génie de matériaux ou génie chimique années expérience en industrie dans le secteur pertinent expérience dans le secteur en industrie lourde aluminium mine et ou aciermicrosoft office excel word powerpoint m project leadership mobilisateur et agent de changement maîtrise de la langue française et anglaise cadre work location montréal qc publish date june error ok careerbeacon com employer career seeker main street po box moncton nb e1c 8p3 ph careerbeacon com copyright careerbeacon com right reserve careerbeacon com register trademark brunswick news inc
