id,title,created,description_from_url,description
555382794,Senior Water/Wastewater Project Manager-Kitchener,2017-05-23T03:32:30Z,1,support kitchener state local team serve municipal water wastewater relate client service position also serve assist deliver project serve develop client direct communication client technical design topic project schedule budget scope lead project team communicate diverse design discipline develop staff coordinate effective quality management process project establish long term client relationship support business development activity lead project team design delivery water wastewater treatment facility design relate study lead investigation review treatment process technology equipment decision analysis perform sophisticate complicate design calculation accordance establish department standard software supervise train mentor le experience project engineer designer support procurement include supplier qualification bid review process design requirement review design drawing supplier document successful resolution manufacture discrepancy support installation generation build drawing onsite support participate development engineer study cost estimate participate construction support activity include response request information rfis submittal review construction site visit design revision management change startup commission trouble shoot prepare detail design milestone schedule staff schedule man hour estimate budget management prepare supervise engineer report study calculation check drawing participate design review risk assessment vendor bid evaluation participate generation proposal scope schedule budget minimum qualification position bachelor degree environmental civil engineer relate engineer discipline minimum year competency work municipal client engineer project management role excellent write verbal communication project plan presentation prove experience design municipal water wastewater treatment facility prove experience lead manage project team consult project adept interpersonal relationship build conflict resolution lead diverse team p eng ontario ch2m great challenge provide big reward day drive creative idea provide solution help build good tomorrow whether pride come accomplishment personal growth make difference world discover true success career bring best ch2m ready let get work develop people challenge project ch2m equal opportunity employer search job like save need save energy jobline ltd power madgex job board technology
555801911,Quality Assurance Specialist I,2017-05-23T21:44:40Z,0,job description location la prairie qc duration month general description qa specialist responsible lead development maintenance quality system metric report operate mechanism help drive site quality objective skill require year experience medical device pharmaceutical industry year experience capa system include complaint handle year experience apply regulation include fda qsrs iso13485
555801914,Quality Assurance Technician I,2017-05-23T21:44:42Z,0,job description location markham duration month general description quality assurance technician perform incoming product inspection finish product assembly compound good manufacture laboratory practice gmp glp verify product meet specification free damage defect person work dazor micrsoscope time skill require candidate must ipc610 certification year industry ex
555802115,Project Quality Manager,2017-05-23T21:44:50Z,0,job description location soldier pond st john nl canada duration month skill require high skilled quality management strong leadership problem solve competent computer m office knowledge synchronous condenser component hvdc converter station fluent english locate near st john newfoundland advantage company description dedicate manpower commit people since bring energy industry people project tog
556019644,"Lead Highway Engineer / Project Manager - Toronto, ON",2017-05-24T03:28:35Z,1,challenge help support transportation client hand transform tomorrow look client face highly personal individual provide day day leadership small highway design team assist senior management strategic business development opportunity strong leadership team build capability look opportunity join firm ceiling role provide day day leadership direct supervision small team highway road drafter tech work closely ontario national international office deliver transportation project role support strong business development team senior road highway engineer design project manager lead highway engineer thorough knowledge highway municipal roadway engineer design actively support business development manager client service manager develop expand opportunity exist new client leverage exist relationship win new work provide input strategy development within geography participate professional society seminar train presentation committee membership advance skill professional relationship champion delivery high quality project meet exceed client expectation responsibility may include project management design lead design support depend type project facilitate mentor help build broad employee network serve mentor project team junior staff junior engineer assist find answer technical question concern serve primary communication link provide business group strategy key information office staff facilitate learn development reward recognition performance issue assign staff work closely operation lead ol project manager assure assignment appropriate staff project monitor project execution progress well actively assist group leader staff resource schedule scope budget client issue necessary achieve successful project completion take action require include involve om regional technology quality manager rtqm improve project performance balance project delivery client ratio metric ensure right staff assign project appropriate amount technical business oversight place performance feedback properly communicate minimum qualification position education experience certification10 year road highway design experience ottawa toronto ontario client experience mto assignment experience design build ppp assignment asset experience write technical proposal asset write verbal communication skill ideal candidate posse follow skill experience degree engineeringp engproject management experience include supervise mentor small team technologist engineer search job like save need save energy jobline ltd power madgex job board technology
556019657,"Proposal Manager/Inside Sales Manager-Calgary, AB",2017-05-24T03:28:35Z,1,challenge help support client hand transform tomorrow job title proposal manager inside sale manager inside sale manager senior proposal manager integral part ch2m inside sale organization partner client sector sale delivery team plan lead drive manage variety strategic business development assignment position ch2m success inside sale career path opportunity help ch2m win work tackle client challenge position opportunity work client pursuit state local government national government private sector range qualification statement strategic complex sale collateral proposal presentation seek motivate energetic self starter demonstrate leadership skill posse excellent oral write communication skill effective listen skill enjoy develop creative solution tackle challenge team player ready support vest interest success ch2m time u work collaborative cross functional team environment help win strategic project help deliver resource capability ch2mactively engage pursuit team sale process discipline budget estimation management win strategy proposal development interview presentation develop implement plan respond client request proposal presentation informationlead proposal presentation team variety pursuit type size gear specific requirement clientthe minimum qualification position basic qualification bachelor degree journalism communication english business technical scientific discipline relate field accredit university10 year experience manage develop proposal presentation relate sale business development deliverablesproposal leadership experience engineer architecture construction industriesadvanced english write edit proofread skill familiarity technical write eye towards sale message theme proposal aesthetic contentstrong leadership quality able manage direct proposal team help drive sale proposal process coordinate negotiate team person remotelywell organize able manage multiple task concurrently engage various stakeholder reviewersability work diverse team le experience inside sale staff senior company leader executive ability lead proposal team establish communicate plan motivate direct team connect dot within company offer solution produce high quality outcome ideal candidate posse follow skill experience prefer qualification knowledge engineer construction industry infrastructure private sector client emerge business industry trend ability actively integrate knowledge work activity market proposal leadership experience client calgary sponsor visa application search job like save need save energy jobline ltd power madgex job board technology
556019650,"Project Controls Manager Transit-Toronto, Ontaio",2017-05-24T03:28:36Z,1,challenge help support transportation client hand transform tomorrow project control manager transit toronto ontario ch2m grow business major transit program require project control manager lead grow project control team incumbent program project control professional substantial experience subject area program project control well ability provide guidance leadership level management structure successful candidate serve think leader technical expert process innovator quality motivator mentor coach cost control schedule estimate document management risk assessment contract administration report development business system integration essential duty responsibility serve think leader innovator program project control provide direction expertise project control relate activity assign project support plan execution operational requirement provide leadership strategic initiative within department project team provide advice counsel team individual area professional expertise accountable director program control matrix responsibility director various project departmental group provide client accurate project control information line meet program project goal create implement execute proper control proactively support monitor communicate budget actual status forecast cost delivery timeframes active develop project successfully manage relationship project control function include estimate schedule cost control risk management report program project departmental process development implementation resolve issue provide consistency cost control plan schedule estimate function deliverable establish effectively leverage cross discipline relationship within departmental group project leadership team facilitate development implementation effective efficient project control system process procedure develop maintain meaningful relationship applicable external entity stakeholder external partner contractor subcontractor supplier represent project control project strategy coordination meeting prove record progressive experience program project controlsable interact client establish relationship articulate project wide issue project delivery knowledge experience require across project delivery method include design build design bid build public private partnership afp delivery apply principle project control cost control plan schedule estimate document management risk assessment contract administration report development business system integration background project schedule relate experience asset resource capability demonstrate effective leadership execution project control activity within department responsible staff resource plan staff development ability influence advise client staff peer communicationsbe able effectively communicate concern complexity general project control information consideration vary audience include client departmental management engineer project construction management project team able define prepare accurate meaningful report narrative letter memorandum clearly communicate status issue concern behalf program control department effectively manage communicate staff organize motivate system proficient spreadsheet word process software database report writer knowledgeable business system interdependency system program control experience specialize control tool p6 cm14 unifier ecosys arm assetdefine strategy deployment modification program project control system appropriate support project specific execution requirement implement effectively use company industry standard project control system minimum qualification position project delivery knowledge experience require across project delivery method include design build design bid build public private partnership afp delivery apply principle project control cost control plan schedule estimate document management risk assessment contract administration report development business system integration background project schedule relate experience asset ideal candidate posse follow skill experience bachelor degree construction management engineer project management relate technical field minimum year progressive experience increase responsibility management project control large project transportation project experience specifically transit experience plus active membership accreditation aace pmi similar association plus candidate must meet qualification search job like save need save energy jobline ltd power madgex job board technology
545384826,Utility Locator,2017-05-06T00:49:04Z,0,utility locator experience underground utility dpt certification brampton area email dbullardfellmore com fax
545359229,Lead Hand,2017-05-06T04:53:56Z,0,job description look next opportunity fast pace excite field automotive manufacture look join team new lead hand position day shift daily responsibility include plan organize supervise daily schedule production ensure require supervision document complete timely accurately employee work area area deem responsible document comple
545740767,Intermediate Electrical Engineer,2017-05-06T11:30:58Z,1,job post job type full timebusiness address suite highway vaughan l4l 8l5number position permanentstart date asap fvb energy inc boutique consult engineer firm specialize district energy combine heat power chp system office minneapolis usa toronto edmonton vancouver ottawa canada fvb energy inc north american subsidiary swedish consult firm fjärrvärmebyrån ab fvb district energy inc fvb commit aid community institution find right alternative energy solution present future need believe district heat district cool cogeneration system connect community institution host energy environmental economic benefit engineer summary fvb seek engineer work toronto office successful candidate support design construction team project stage development employee fvb energy successful candidate apply accept engineer principle design initiative position require candidate comfortable work multiple project different stage give timepossesses excellent communication time management skillsis self motivate able work part team individually dutiesassist engineer team provide relate electrical design forthermal energy plant distribution pip build energy transfer station projectsassist preparation feasibility studiesassist preparation engineer proposalsprepare material takeoff support estimate cost projectsapply previous knowledge experience todesignprojectswork cad designersliaise client consultant contractor vendor coordinate share project information discus project design relate problemstake responsibility complete specific design task develop one line diagram load schedule power light design conduct power factor study equipment selection scada fire alarm system motor transformer switchgear generator design calculation short circuit analysis relay protection scheme substation generator preparation construction tender document projectsassist selection energy plant equipment chiller boiler gensets cool tower pump etc assist preparation specification drawing large projectsplay key role preparation issuanceof equipment tender package tender process bid evaluation recommendation reportconduct site visit construction supervision project commission service issue report minimum experience education requirementsbachelor degree apply science engineer specialize electrical engineering5 year minimum professional experience engineer position preferably district energyor relate industrytraining experience lux calculation use dialux software equivalentproject management train pmp equivalent one year experiencetraining experience fidic experience electrical engineer software product schneider ecodial power world simulator homer energy software equivalent train experience autocadproficiency work microsoft office environmentexcellent write oral english communication skillsthree year commission experience information salary range offeredis annually pay monthly employee performance review annually bonus pay subject fvb profitability fvb offer comprehensive benefitspackage full time employee include health dental insurance life disability insurance pay vacation holiday retirement plan interest work fvb energy inc please email resume cover letter subject head fvb engineer kmarietta fvbenergy com thank candidate show interest position select interview contact agency phone call please page want job like subscribe email address submit revoke consent email time continue agree monster job summary location woodbridge l4l 8l5 job type full time employee salary yearpotential bonus post day ago industry energy utility education level bachelor degree career level experience non manager view info view le info company company name fvb energy find job email job close email email send note email address use mail delivery job high contrast version copyright monster worldwide u patent b1 v copyright monster worldwide u patent b1 v
545954027,Calibration Technician,2017-05-06T21:36:28Z,0,digital measurement metrology inc automatic road unit brampton canada l6s 5n7 calibration technician brampton position calibration technician department calibration laboratory start date immediately report lab manager technical manager duty responsibility calibrate instrument force gauge micrometer caliper balance torque wrench surface plate kind dimensional gauge within scope experience authorization repair adjust
546094821,Red Seal Automotive Mechanic For Road Service Technician $28/hr 2011534 Job,2017-05-07T03:46:04Z,1,presently seek red seal road service technician repair maintain raymond bt brandx lift truck waterville n location make hrabout uswe industry lead company material handle equipment solution canada company stand behind year business excellence offer opportunity support company one large strategic capacity provide chance self improvement safe stimulate environment imagine make difference dynamic team work together common goal client satisfaction every client employee value important look ideal candidate automotive mechanic good hand knack thing technical skilled mechanical electrical information technology skill role conduct maintenance check diagnose repair lift truck carousel customer site familiar examine overall operational integrity condition truck pride strong time management skill requirement experience diagnose perform preventative corrective maintenance correct electrical relate issue automobile lift truck must minimum year experience trade explain procedure repair additional maintenance work require customer effort attain trust relationship long term retention valid mechanic license driver license province employment absolute must ability work effectively computerize system experience similar role consider asset ability serve customer professional manner inspire confidence trust come work u offer employee competitive wage base experience benefit package work life balance opportunity grow expand professional personal skill also provide technical tool technician support position include late technology ipad iphone work standard gps pride excellent company culture clean safe work environment commitment equal opportunity company welcome application qualify candidate please apply keywords automotive mechanic auto mechanic automotive technician auto tech shop mechanic class mechanic automotive service technician nova scotia n greenwood wilmot kingston bridgetown aylesford berwick waterville coldbrook kentville port williams can wolfville grand pre granville annapolis royal bear river mechanic automotive automobile car mechanic technician tech car repair car tech car road service road service technician red seal contact information contact name net hire company type company city toronto state ontario zip web site job spider
546094829,Red Seal Automotive Mechanic For Road Service Technician $28/hr 2011537 Job,2017-05-07T03:46:07Z,1,presently seek red seal road service technician repair maintain raymond bt brandx lift truck waterville n location make hrabout uswe industry lead company material handle equipment solution canada company stand behind year business excellence offer opportunity support company one large strategic capacity provide chance self improvement safe stimulate environment imagine make difference dynamic team work together common goal client satisfaction every client employee value important look ideal candidate automotive mechanic good hand knack thing technical skilled mechanical electrical information technology skill role conduct maintenance check diagnose repair lift truck carousel customer site familiar examine overall operational integrity condition truck pride strong time management skill requirement experience diagnose perform preventative corrective maintenance correct electrical relate issue automobile lift truck must minimum year experience trade explain procedure repair additional maintenance work require customer effort attain trust relationship long term retention valid mechanic license driver license province employment absolute must ability work effectively computerize system experience similar role consider asset ability serve customer professional manner inspire confidence trust come work u offer employee competitive wage base experience benefit package work life balance opportunity grow expand professional personal skill also provide technical tool technician support position include late technology ipad iphone work standard gps pride excellent company culture clean safe work environment commitment equal opportunity company welcome application qualify candidate please apply keywords automotive mechanic auto mechanic automotive technician auto tech shop mechanic class mechanic automotive service technician nova scotia n greenwood wilmot kingston bridgetown aylesford berwick waterville coldbrook kentville port williams can wolfville grand pre granville annapolis royal bear river mechanic automotive automobile car mechanic technician tech car repair car tech car road service road service technician red seal contact information contact name net hire company type company city toronto state ontario zip web site job spider
546105945,Plan Checker Calculator,2017-05-07T04:05:06Z,0,currently seek plan checker calculator join team employee own high performance progressive consultancy provide comprehensive survey geomagnetic project management service variety industry since people drive u forward strive hire train retain smart drive individual company diverse work force create excite dynamic work atmosphere empower education train recognize excellence challen
546002678,Process Engineer,2017-05-07T04:45:38Z,0,job description key responsibility position procure estimate equipment process cost take equipment quotation installation new program change exist program result engineer change liaise vendor monitor progress quotation design build installation stage new equipment necessary new program utilize experience expertise cross functional team member ensure equipment meet co
