id,title,created,description_from_url,description
567533598,Mechanical Drafter / Designer,2017-06-08T18:24:09Z,1,newlands systemsnewlands system division dme lp premier north american brew equipment manufacturer year experience design brewery brewmaster perspective design custom fabrication site installation train pride customer every step way two modern asme iso certify facility abbotsford british columbia maintain unparalleled commitment excellence quality customer service innovation believe people great asset aim train develop motivate team build challenge reward successful career u rolenewlands system currently seek mechanical drafter designer join team abbotsford british columbia full time basis integral member engineer team mechanical drafter designer responsible create update drawing test prepare report management stakeholder key responsibility include understand architectural mechanical drawing develop cost efficient quality design process equipment ensure customer requirement meet company standard produce manufacture drawing use solidworks inventor ensure timely delivery drawing meet production schedule perform simple engineer calculation interact fabricator shop floor ensure quality resolve problemsthis role call highly organize detail orient individual enjoy work fast pace environment proactive planner prove ability manage time effectively balance multiple priority qualify cad draft certificate diploma equivalent previous experience manufacture process industry successful candidate also demonstrate proficiency solidworks microsoft office application knowledge mechanical component machine design machine practice theoretical knowledge fabrication weld procedure excellent communication skill write verbal ability work independently minimal supervisionabout benefitsat newlands system receive competitive annual salary commensurate experience skill qualification also receive access great range employee benefit probationary period include performance base incentive bonus medical dental vision benefit company match rrsp death disability life insurance opportunity train professional developmentupon join u also welcome friendly social team environment recognize reward hard work addition team social event also offer modern clean safe work environment plus great career advancement opportunity miss opportunity join team company pride clean high quality finish great work environment share passion would love hear apply online today
567533688,Manufacturing Engineer - $65K - $75K - Permanent North GTA,2017-06-08T18:24:10Z,1,look opportunity apply technical knowledge develop implement new improve manufacture process procedure may right opportunity currently excite full time permanent opportunity one client locate north gta role offer competitive salary great benefit room growth responsibility create new process improvement continuous improvement manufacture plant involve implementation process study work cell create recommendation source new equipment involvement implement facility hand roll sleeve floor process improvement projectsrequirements degree engineer prefer year manufacture process implementation experience previous experience automotive industry knowledge pfmea pfc dfma require ability show hand work experienceif experience please apply online send resume please note qualify contact good know yourandstad canada commit foster inclusive accessible environment employee customer feel value respect support dedicate build workforce reflect diversity customer community live serve create environment every employee opportunity reach potential welcome application woman aboriginal person person disability ethnic minority visible minority others may contribute diversification part commitment accessibility person disability randstad canada upon request applicant provide accommodation recruitment process ensure equal access applicant disability please contact randstad recruiter consultant need consult ensure suitable accommodation provide qualify applicant encourage apply however accordance canadian immigration requirement canadian permanent resident give priority feedback equity accommodation need please contact local randstad canada branch want job like subscribe email address submit revoke consent email time continue agree monster job summary location newmarket job type full time temporary contract project post day ago industry staff employment agency reference code view info view le info company company name randstad job randstad find job revoke consent email time continue agree monster email job close email email send note email address use mail delivery job high contrast version copyright monster worldwide u patent b1 v copyright monster worldwide u patent b1 v
567533702,Superintendent (Civil) - Water Waste Water,2017-06-08T18:24:13Z,1,superintendent civil water waste water monster com superintendent civil water waste water maple reinders inc mississauga job superintendent water waste water construction position enjoy leader team construction professional focus deliver quality project every time leadership goal look right organization grow build career superintendent stellar safety record maintain solid relationship project manager client key project stakeholder next step career superintendent busy heavy civil environmental division responsibility oversee site staff field engineer field team accountable delivery complete civil environmental project maple reinders grow organization continually win new work come new experience new challenge maple look leader direct field operation delivery project adhere schedule budget safety risk effectively manage field employee provide guidance leadership construction activity develop effective communication field project staff develop execute project work plan aim keep project track budget provide senior level presence field coach field staff issue resolution review site labour requirement mentor field staff perform succession plan superintendent oversee project vary size scope successful candidate previous experience lead construction team trade hourly employee current project locate toronto kingston would require superintendent travel stay close site flexibility must also focus candidate currently minimum year construction experience general contractor leadership role post secondary education cet equivalent proficiency m office window base computer application word excel outlook project manage site operation complex project excess millionsalary benefit salary range plus depend experience eligible company truck full time permanent role benefit include supplementary medical dental std ltd ad life insurance health spend account access site gym superintendent key member maple reinders project team critical success project direction want succeed prepare get invest offer extensive train centre learn facilitate career growth program leed gold seal lunch learn would like part continue success please provide project list include dollar value along resume cover letter select apply button submit application otherwise email application thank interest career maple reinders select interview contact maple reinders equal opportunity employer upon request maple reinders accommodate candidate disability throughout hire process agency call please business address maple reinders constructor ltd argentia roadmississauga l5n 5v4phone people passion performance want job like subscribe email address submit revoke consent email time continue agree monster job summary location mississauga job type full time employee post day ago industry construction industrial facility infrastructure engineer service career level manager manager supervisor staff reference code view info view le info contact information contact name maple reinders inc phone ext company company name maple reinders inc job maple reinders inc find job enter email address receive job like close email address revoke consent email time continue agree monster email job close email email send note email address use mail delivery job high contrast version copyright monster worldwide u patent b1 v copyright monster worldwide u patent b1 v
567533742,Electromecanicien,2017-06-08T18:24:13Z,1,vous aimez le contexte de petite entreprises où doit mettre la main à la pâte à différents niveaux notre client une compagnie de la région de sherbrooke cherche un électromécanicien pour combler un poste permanent de jour nous cherchons plus précisément un candidat polyvalent à l aise dans tous le aspect du métier pneumatique hydraulique électricité automatisation contrôles votre travail ne serum jamais routinier plusieurs projets vous attendent dont celui de la mise en place un programme de maintenance préventive avantages poste permanent de jour environnement de travail propre poste qui vous permettra de mettre à profit votre autonomie votre créativité et votre savoir faire étant la référence technique de l entreprise salaire entre heure selon dep en électromécanique devra être combiné à quelques années expérience dans le domaine de la maintenance nous recherchons un candidat passionné curieux désireux de investir à long terme pour la compagnie vous vous sentez interpelé par cette description contactez amélie ou karine au poste et faites nous parvenir votre cv à amelie catherine karine raphaeletéléphone télécopieur canada souscrit à la diversité et à l équité en matière emploi et favorise un environnement inclusif et accessible dans lequel le client et le employés se sentent respectés et supportés nous nous engageons à construire une force de travail qui réflète la diversité de no client et de communautés dans lesquelles nous vivons et nous oeuvrons et nous créons un environnement propice à ce que chaque employé ait l opportunité atteindre son plein potentiel randstad accueille favorablement le demand emploi de femmes de peuples autochtones de minorités ethniques de personnes handicapées de minorités visibles et autres personnes qui pourraient contribuer à une plus grande diversité dans le cadre de notre engagement à l accessibilité de personnes ayant un handicap randstad canada sur demande du candidat fournira un accommodement pendant le processus de recrutement pour assurer l égalité accès à tous le candidats veuillez svp contacter votre consultant ou recruteur concernant vos besoins et nous vous consulterons afin de nous assurer qu un accommodement raisonnable adapté à vos besoins vous soit fourni nous encourageons tous le candidats qualifiés à postuler veuillez noter que conformément aux exigences de l immigration canadienne la priorité serum toutefois accordée aux canadiens ainsi qu aux résidents permanent veuillez svp communiquer avec votre succursale locale pour tout commentaire sur l équité ainsi que pour tout besoin accommodement want job like subscribe email address submit revoke consent email time continue agree monster job summary location sherbrooke qc job type full time temporary contract project post day ago industry staff employment agency reference code view info view le info company company name randstad job randstad find job revoke consent email time continue agree monster email job close email email send note email address use mail delivery job high contrast version copyright monster worldwide u patent b1 v copyright monster worldwide u patent b1 v
567533814,Tunneling Construction Manager,2017-06-08T18:24:13Z,1,id engineeringlocation city ab calgaryregion calgary areajob type permanentrecruiter name stuart brazier please submit resume directly stuart brazier via email call stuart directly opportunity tunnel construction manager look join large scale project allow rotational work rotation hub calgary vancouver kelowna edmontonkey account responsibility functionsin charge portion u g tunnel operation comply applicable safety quality environmental requirement provide leadership strategic direction oversight construction team collaborate partner internal external execute project activity time budget ensure project work safely complete schedule compliance contract well job cost estimate work perform efficiently complete acceptable standard quality workmanship please quote job reference submit resume directly stuart brazier via email call stuart directly executrade one large comprehensive full service recruitment firm western canada division location edmonton calgary vancouver year experience help client company candidate achieve business goal vision success due people strong relationship build continuous robust evaluation refine recruitment staff process individual interest employment opportunity must obtain necessary approval government canada citizenship immigration department prior apply position accordance canadian immigration law priority give canadian citizen permanent resident canada employment opportunity detail information obtain want job like subscribe email address submit revoke consent email time continue agree monster job summary location calgary ab job type full time employee post day ago industry financial service career level experience non manager reference code view info view le info follow company company executrade consultant ltd executrade one large comprehensive full service recruitment firm western canada division location edmonton calgary vancouver almost year experience help candidate company achieve goal vision success due people strong relationship build continuous robust evaluation refine recruitment staff process candidate care understand take help find right organization fee job seeker service consider much client organization work carefully review résumé submit u ensure find best fit candidate client executrade recruit specialist job executrade consultant ltd find job enter email address receive job like close email address revoke consent email time continue agree monster email job close email email send note email address use mail delivery job high contrast version copyright monster worldwide u patent b1 v copyright monster worldwide u patent b1 v
567533749,Senior Buyer,2017-06-08T18:24:14Z,1,senior buyerthis excite contract opportunity one major midstream client client look add senior buyer supply chain management group support maintenance capital project project include turnaround large scale facility capital work approximately project book year volume quite significant key skill responsibility ability multi task manage large workload number concurrent contract po project various stage responsibile usual end end contract management responsible standard attestation responsible invoice verification responsible gr ir need upfront project plan contract strategy need able execute project implementation plan work esp epcs regard party procurement oversight esp experience qualification requirement need year procurement supply chain experience site field experience asset ops facility experience require natural gas sagd upstream midstream owner midstream experience preferable experience buy ops facility turnaround material equipment randstad canada commit foster inclusive accessible environment employee customer feel value respect support dedicate build workforce reflect diversity customer community live serve create environment every employee opportunity reach potential welcome application woman aboriginal person person disability ethnic minority visible minority others may contribute diversification part commitment accessibility person disability randstad canada upon request applicant provide accommodation recruitment process ensure equal access applicant disability please contact randstad recruiter consultant need consult ensure suitable accommodation provide qualify applicant encourage apply however accordance canadian immigration requirement canadian permanent resident give priority feedback equity accommodation need please contact local randstad canada branch want job like subscribe email address submit revoke consent email time continue agree monster job summary location calgary ab job type full time temporary contract project post day ago industry staff employment agency reference code view info view le info company company name randstad job randstad find job revoke consent email time continue agree monster email job close email email send note email address use mail delivery job high contrast version copyright monster worldwide u patent b1 v copyright monster worldwide u patent b1 v
567533786,Prism Data Technician - Level 1 (3 Month Contract),2017-06-08T18:24:14Z,1,phoenix technology service job application prism data technician level month contract monster com prism data technician level month contract phoenix technology service calgary ab job phoenix technology service lp progressive innovative calgary base directional drill company drive client need commit provide efficient cost effective drill operation open prism optimization data technician base se technical centre location month contract position data technician responsible provide positive contribution team environment intend maximize efficiency prism organization serve customer realize group yearly objective include collection presentation data help support recommendation advice operation relate tool ongoing well site operation conduct remote operation service contribute wellsite operation support field operator complete client satisfaction remote activity incumbent also provide innovative solution client eliminate non productive time maximize producible section optimize drill performance responsibility also include assist prism optimization centre coordinator organization data deliverable provide client periodically throughout drill process carry project acquire data various online source organize require presentation format prepare pre delivery quality verification work prism optimization team associate stakeholder help ensure process acquire organize present various data stream handle efficient timely manner require client delivery time achieve assist establishment maintenance positive line communication well site prism optimization centre foster team environment ensure shift report accurately complete submit prior completion shift ensure identify issue develop issue accurately evaluate communicate various stakeholder establish communication channel prior completion work shift assist identification capture best bad practice ensure ongoing efficiency data delivery process service perform hour rotate shift environment work schedule define assist development communication enforcement safety policy procedure create specialize presentation activity report include data delivery responsibility duty deem necessary work stakeholder help develop new operation policy technical alert require successful candidate bachelor degree technical diploma mechanical petroleum engineer bachelor degree geoscience mwd rig experience also prefer individual organize superior communication m office skill want job like subscribe email address submit revoke consent email time continue agree monster job summary location calgary ab job type full time employee post day ago industry energy utility company company name phoenix technology service job phoenix technology service find job email job close email email send note email address use mail delivery job high contrast version copyright monster worldwide u patent b1 v copyright monster worldwide u patent b1 v
567533816,Design Engineer Professional: CATV Broadband/ Telecommunications OSP Engineering,2017-06-08T18:24:15Z,1,access communication co operative limit job application design engineer professional catv broadband telecommunication osp engineer monster com design engineer professional catv broadband telecommunication osp engineer access communication co operative limit regina sk s4n7k7 job access communication co operative limit seek focus leader positive attitude thrive accuracy multitasking meet deadline join team design engineer professional responsible design new exist catv fibre saskatchewan access fast pace dynamic organization positive team orient work environment one saskatchewan top employer offer competitive wage comprehensive benefit package main duty include leadership oversee assist mentor team osp outside plant hfc hybrid fibre coax designer catv broadband engineer design osp outside plant hfc hybrid fibre coax engineer designhfc hybrid fibre coax node splitsbau business usual design workosp outside plant fiber engineer designfttx ftth fibre home fttp fibre premise fttn fibre node mdu multi dwell unit build entrance facility designhfc fiber metroe engineer commercial business hfc fiber residential commercial plant extensionsfield surveysbill material creationdrafting documentationrecords post updatestechnical proficiency autocad trueview equivalent m office suite row acquisition permittingsome knowledge earth topologytechnical service understand plant construction managementdesign draw quality assurance quality control plant construction quality assurance quality control project managementproficient build business relationsfield visit auditscommunication skill demonstrate write oral communication within organizationbusiness appropriate email communication outside organizationbusiness appropriate telephone communication outside organizationclear accurate timely record keepingrequirements minimum year prove experience lead team design professionalsmust knowledge hybrid fibre coaxial aerial bury underground build entrance designsupporting design engineer process plan prepare drawing construction new removal rearrangement exist fiber optic cable coaxial cable conduit obtain optimum economical utilization communication facilitiesmust able read understand highway road print able identify conflict exist outside plant facility select rout require work projectsmay require provide site construction inspection ensure design specification meet design team construction contractor duty may include redline bore design cad make ready analysis field note pole survey sonde conduit locate qc print pdf drawing preparation printsqualifications thorough knowledge accept catv telecommunication engineer practicesthorough knowledge aerial bury cable placement splice method conduit coaxial fiberability track prioritize complete multiple project solve decision make skillsanalytical research skillsability meet deadline work others team environmentability travel locally overnight time time class driver license sound like please apply career section deadline friday june want job like subscribe email address submit revoke consent email time continue agree monster job summary location regina sk s4n7k7 job type full time employee post day ago industry telecommunication service education level bachelor degree career level experience non manager view info view le info contact information contact name victoria buehler phone address park streetregina sk s4n7k7 company company name access communication co operative limit find job email job close email email send note email address use mail delivery job high contrast version copyright monster worldwide u patent b1 v copyright monster worldwide u patent b1 v
567533811,Tunneling Engineer,2017-06-08T18:24:16Z,1,id engineeringlocation city ab calgaryregion calgary areajob type permanentrecruiter name stuart brazier please submit resume directly stuart brazier via email call stuart directly opportunity great opportunity available tunnel engineer work closely tunnel construction manager join large scale project rotational work rotation hour flight hub calgary vancouver kelowna edmontonkey account responsibility functionscontribute civil structural work associate tunnel construction major project responsible plan liaise designer sub contractor quantity track report provide underground construction discipline support department quality safety environmental daily construction report assist superintendent site management please quote job reference submit resume directly stuart brazier via email call stuart directly executrade one large comprehensive full service recruitment firm western canada division location edmonton calgary vancouver year experience help client company candidate achieve business goal vision success due people strong relationship build continuous robust evaluation refine recruitment staff process individual interest employment opportunity must obtain necessary approval government canada citizenship immigration department prior apply position accordance canadian immigration law priority give canadian citizen permanent resident canada employment opportunity detail information obtain want job like subscribe email address submit revoke consent email time continue agree monster job summary location calgary ab job type full time employee post day ago industry financial service career level experience non manager reference code view info view le info follow company company executrade consultant ltd executrade one large comprehensive full service recruitment firm western canada division location edmonton calgary vancouver almost year experience help candidate company achieve goal vision success due people strong relationship build continuous robust evaluation refine recruitment staff process candidate care understand take help find right organization fee job seeker service consider much client organization work carefully review résumé submit u ensure find best fit candidate client executrade recruit specialist job executrade consultant ltd find job enter email address receive job like close email address revoke consent email time continue agree monster email job close email email send note email address use mail delivery job high contrast version copyright monster worldwide u patent b1 v copyright monster worldwide u patent b1 v
