id,title,created,description_from_url,description
568129032,"Analyst, Engineering and Technology",2017-06-09T18:39:36Z,1,report national manager engineer technology analyst work regional base team responsible deployment support equipment process plant retail outlet administration office canada post business partner customer analyst support client base acquisition troubleshoot repair relate equipment basisthe successful candidate provide technical support user community technical cpc group contractor ensure equipment perform specification identify equipment enhancement opportunity meet operational requirement responsible code compliance pertain cable infrastructure computer room standard well installation methodology deploy equipment establish manage project team use internal external resource appropriate prepare specification statement work support procurement process work cpc group contractor pilot proof concept new system evaluation mode organize manage time ensure availability human financial material resource necessary completion either daily task project work lead secondary role troubleshoot maintain awareness state art technology apply environment work internal external group oversee assist disaster recovery plan maintain network mail operation system high availability procure assist user procurement hardware software contract service require equipment enhancement proactively ensure high availability network analysis study report outline historical performance recommend procure require enhancement need assist group team member travel city region may require project scope problem resolution warrant additional resource technical specialist time leave hardware associate program job requirement education work experience university degree college diploma specialist train discipline minimum year recent work experience support relate field minimum year experience follow microsoft office product word excel access project visio ie exchange etc b apple intel base osc android kitkat marshmallow blackberry mobility o window o xp e belden fibre copper wire infrastructure design troubleshoot installation methodology f familiarity wifi bluetooth rfid operation troubleshoot g use copper fibre wifi bluetooth test equipment fluke prefer h tcpipi window o support installationj basic pc fibre copper wire network hardware repair troubleshootingk telephony equipment ip avaya tdm system l av presentation setup troubleshoot portable integrate solution video surveillancen raspberry pie device able identify technology solution meet customer needs4 strong communication skill problem solve approach customer service5 able write professional technical business documents6 able manage time resource meet require deadlinesas part selection process select candidate require complete security screen processnotice applicant order canada post human resource invite applicant interview please ensure email communication consent preference set allow email consent may find career profile applicant check email junk spam folder regularly canada post communicate applicant via email leadership behaviour corporate value decision make champion organization take calculate risk make prudent common sense decision current issue future opportunity resource requirement timely well think manner align corporation best interest accountability individual strive performance excellence hold direct report accountable decision action learn mistake intend result achieve business orientation proactive individual understand competitive nature business commit sustain business excellent customer service new business opportunity execution focus self motivate individual act sense urgency deliver time within budget deal effectively challenge ambiguous situation lead people compel communicator leader engage motivate inspire others achieve result encourage personal growth find good way thing information job successful candidate must valid g driver license good stand travel facility gta require responsible support enhance repair design technology limit network switch router ethernet wire infrastructure belden single multimode fibre copper infrastructure wifi rfid bluetooth infrastructure cellular retransmission network bluetooth base infrastructure window apple base hardware software desktop laptop tablet etc handheld compute device pdt tablet o android blackberry apple etc handheld audio communication device cell phone audio visual public address networkscanada post offer total compensation package competitive salary annual incentive program comprehensive individual family benefit coverage vacation leave option canada post register pension plana strong community employee employee drive innovation ensure business continue evolve meet customer change needsthe satisfaction job well do part win team touch life millionscareers deliver ready make difference discover full potential canada post deliver variety excite challenge career opportunity across country one canada large employer commit attract retain develop win team meet evolve need canadian secure future canada post commit employment equity encourage application woman aboriginal people person disability visible minority conflict interest policy prohibit employee hire supervise report directly indirectly via report hierarchy immediate family close personal relation feel may actual potential conflict interest regard job opportunity must communicate designate human resource representative contact canada post regard job opportunity test please advise require accommodation important message application must clearly demonstrate meet requirement canada post cannot make assumption education experience thank apply select consideration contact interest job career information date post june ad number j0117 career type permanent full time career category employer information saskatoon saskatchewan parry sound ontario dawson creek british columbia sussex new brunswick quebec city quebec similar career flexible quebec nanticoke ontario saint john new brunswick toronto ontario toronto ontario analyst engineer technology job report national manager engineer technology analyst work regional base team responsible deployment support equipment process plant retail outlet administration office canada post business partner customer analyst support client base acquisition troubleshoot repair relate equipment basisthe successful candidate provide technical support user community technical cpc group contractor ensure equipment perform specification identify equipment enhancement opportunity meet operational requirement responsible code compliance pertain cable infrastructure computer room standard well installation methodology deploy equipment establish manage project team use internal external resource appropriate prepare specification statement work support procurement process work cpc group contractor pilot proof concept new system evaluation mode organize manage time ensure availability human financial material resource necessary completion either daily task project work lead secondary role troubleshoot maintain awareness state art technology apply environment work internal external group oversee assist disaster recovery plan maintain network mail operation system high availability procure assist user procurement hardware software contract service require equipment enhancement proactively ensure high availability network analysis study report outline historical performance recommend procure require enhancement need assist group team member travel city region may require project scope problem resolution warrant additional resource technical specialist time leave hardware associate program job requirement education work experience university degree college diploma specialist train discipline minimum year recent work experience support relate field minimum year experience follow microsoft office product word excel access project visio ie exchange etc b apple intel base osc android kitkat marshmallow blackberry mobility o window o xp e belden fibre copper wire infrastructure design troubleshoot installation methodology f familiarity wifi bluetooth rfid operation troubleshoot g use copper fibre wifi bluetooth test equipment fluke prefer h tcpipi window o support installationj basic pc fibre copper wire network hardware repair troubleshootingk telephony equipment ip avaya tdm system l av presentation setup troubleshoot portable integrate solution video surveillancen raspberry pie device able identify technology solution meet customer needs4 strong communication skill problem solve approach customer service5 able write professional technical business documents6 able manage time resource meet require deadlinesas part selection process select candidate require complete security screen processnotice applicant order canada post human resource invite applicant interview please ensure email communication consent preference set allow email consent may find career profile applicant check email junk spam folder regularly canada post communicate applicant via email leadership behaviour corporate value decision make champion organization take calculate risk make prudent common sense decision current issue future opportunity resource requirement timely well think manner align corporation best interest accountability individual strive performance excellence hold direct report accountable decision action learn mistake intend result achieve business orientation proactive individual understand competitive nature business commit sustain business excellent customer service new business opportunity execution focus self motivate individual act sense urgency deliver time within budget deal effectively challenge ambiguous situation lead people compel communicator leader engage motivate inspire others achieve result encourage personal growth find good way thing information job successful candidate must valid g driver license good stand travel facility gta require responsible support enhance repair design technology limit network switch router ethernet wire infrastructure belden single multimode fibre copper infrastructure wifi rfid bluetooth infrastructure cellular retransmission network bluetooth base infrastructure window apple base hardware software desktop laptop tablet etc handheld compute device pdt tablet o android blackberry apple etc handheld audio communication device cell phone audio visual public address networkscanada post offer total compensation package competitive salary annual incentive program comprehensive individual family benefit coverage vacation leave option canada post register pension plana strong community employee employee drive innovation ensure business continue evolve meet customer change needsthe satisfaction job well do part win team touch life millionscareers deliver ready make difference discover full potential canada post deliver variety excite challenge career opportunity across country one canada large employer commit attract retain develop win team meet evolve need canadian secure future canada post commit employment equity encourage application woman aboriginal people person disability visible minority conflict interest policy prohibit employee hire supervise report directly indirectly via report hierarchy immediate family close personal relation feel may actual potential conflict interest regard job opportunity must communicate designate human resource representative contact canada post regard job opportunity test please advise require accommodation important message application must clearly demonstrate meet requirement canada post cannot make assumption education experience thank apply select consideration contact interest job canada post corporation work location toronto publish date june error ok careerbeacon com employer career seeker main street po box moncton nb e1c 8p3 ph careerbeacon com copyright careerbeacon com right reserve careerbeacon com register trademark brunswick news inc
568129222,Chargé de projets spéciaux (Ingénierie),2017-06-09T18:39:41Z,1,position summary le titulaire du poste est responsable de la planification opérationnelle de la gestion de l exécution de projets de construction aménagement et installation équipements pour le centre de distribution responsabilités spécifiques préparer le échéanciers et le budget détaillés de travaux de construction et installation de équipements selon le projet établi par le groupe de planification de concert avec le client interne et externes coordonner le activités de projets avec le service de la distribution et de la logistique effectuer ou mandater différentes ressources interne ou externes pour obtenir de relevés physique contrôler et gérer le budget exécution et le avis de changements pour chacun de projets faire préparer le plan de construction en fonction de plan aménagement et effectuer ou superviser toute demande de permis de construction organiser et superviser le processus de appels offres équipements et contrats de construction en fonction de échéanciers préparer recevoir et analyser le appels offres et accorder le différents contrats de construction superviser l exécution de projets et régler différentes problématiques technique de chantier auprès de entrepreneur faire suivre le problèmes ordre conceptuel et ou opérationnel vers le planificateur de programme effectuer la fermeture de projets critères admissibilité baccalauréat en génie membre de l ordre de ingénieurs à an expérience en gestion de projets de construction dans le secteur commerce de détail et en centre de distribution connaissance de l environnement window excel m project et sap bilinguisme essentiel parlé et écrit déplacements fréquents à toronto à chaque semaine compétences connaissance de l environnement professionnel orientation vers un travail service de qualité connaissances technique et professionnelles communication interpersonnelle gestion de priorités autonomie habileté de négociation résolution de problèmesseuls le candidats sélectionnés pour une entrevue seront contactés veuillez préciser le titre du poste metro est dédiée à la promotion un milieu de travail diversifié nous considérerons tous le candidats qualifiés pour l emploi postulé career information date post june ad number x78rapw0ex7w career category employer information pointe aux tremble quebec montréal quebec toronto ontario laval quebec rivière de prairie quebec similar career flexible quebec nanticoke ontario saint john new brunswick toronto ontario toronto ontario chargé de projets spéciaux ingénierie job position summary le titulaire du poste est responsable de la planification opérationnelle de la gestion de l exécution de projets de construction aménagement et installation équipements pour le centre de distribution responsabilités spécifiques préparer le échéanciers et le budget détaillés de travaux de construction et installation de équipements selon le projet établi par le groupe de planification de concert avec le client interne et externes coordonner le activités de projets avec le service de la distribution et de la logistique effectuer ou mandater différentes ressources interne ou externes pour obtenir de relevés physique contrôler et gérer le budget exécution et le avis de changements pour chacun de projets faire préparer le plan de construction en fonction de plan aménagement et effectuer ou superviser toute demande de permis de construction organiser et superviser le processus de appels offres équipements et contrats de construction en fonction de échéanciers préparer recevoir et analyser le appels offres et accorder le différents contrats de construction superviser l exécution de projets et régler différentes problématiques technique de chantier auprès de entrepreneur faire suivre le problèmes ordre conceptuel et ou opérationnel vers le planificateur de programme effectuer la fermeture de projets critères admissibilité baccalauréat en génie membre de l ordre de ingénieurs à an expérience en gestion de projets de construction dans le secteur commerce de détail et en centre de distribution connaissance de l environnement window excel m project et sap bilinguisme essentiel parlé et écrit déplacements fréquents à toronto à chaque semaine compétences connaissance de l environnement professionnel orientation vers un travail service de qualité connaissances technique et professionnelles communication interpersonnelle gestion de priorités autonomie habileté de négociation résolution de problèmesseuls le candidats sélectionnés pour une entrevue seront contactés veuillez préciser le titre du poste metro est dédiée à la promotion un milieu de travail diversifié nous considérerons tous le candidats qualifiés pour l emploi postulé metro work location pointe aux tremble qc publish date june error ok careerbeacon com employer career seeker main street po box moncton nb e1c 8p3 ph careerbeacon com copyright careerbeacon com right reserve careerbeacon com register trademark brunswick news inc
568129443,Bridge Engineer,2017-06-09T18:39:45Z,0,close date fill location fredericton nb halifax n base candidate preference look opportunity bring creative solution important project part friendly close knit team want work organization offer work life balance work hard fun motto environment employee consider member family want hear let u help reach full potential
568131446,AV Engineer / Programmer,2017-06-09T18:40:35Z,0,action data paladin technology one canada lead technology contract company expertise aspect voice data communication audio visual wireless electrical temporary full time opportunity av engineer programmer potential permanent position ideal candidate experience quote design program comprehensive commercial audio visual solution responsibility engineer program design drawing
