id,title,created,description_from_url,description
525866566,Receptionist cum Back Office Executive,2017-04-04T19:19:58Z,0,"SkillSet: receptionist, good communication skills. answer telephone, screen and direct calls take and relay messages provide information to callers deal with queries from the public and customers ensure knowledge of staff movements in and out of organization monitor visitor access and maintain security awareness provide general administrative and clerical support prepare correspondence and documents receive and sort mail and deliveries schedule appointments maintain appointment diary either man…"
525866565,Front Desk Executive,2017-04-04T19:19:58Z,0,"SkillSet: front office, good communication skills. Gender Female Description Responsibilities: Serve visitors by greeting, welcoming, directing and announcing them appropriately. Answer, screen and forward any incoming phone calls while providing basic information when needed. Receive and sort daily mail/deliveries/couriers. Maintain security by following procedures and controlling access (monitor logbook, issue visitor badges). Update appointment calendars and schedule meetings/appointments. P…"
525866593,Content writers,2017-04-04T19:19:59Z,0,"SkillSet: content writer, content writing. Develop, write and edit content including articles, blogs, websites and social media content under a variety of deadlines. Perform background research and interview subject matter experts to write compelling content that will engage target audience."
525866638,General Manager Marketing,2017-04-04T19:20:02Z,0,"SkillSet: Marketing, sales. Should be experience in Marketing of EPC packages of Thermal Plants, Coal / Ash /Steel plant / Water Systems, Coal Washeries Products etc. 2. Must be familiar with Techno-Commercial understanding of Power / Mining Sector & Prevalent Technologies and have good exposure in interacting with clients, OEMs and consultants in India. 3. Should possess sound knowledge in various components of Steel Plants, Power Plants, Railways, Turbine Generating Units, Heavy Engineering W…"
525866658,Medico Marketing,2017-04-04T19:20:03Z,0,"SkillSet: Medico, Marketing. We have urgent opening of Medical Service/ Medico Marketing. Description: The position is responsible for the following activities: Medical WritingPreparation of CME presentations for senior DrsNew Product Evaluation and LaunchData mining from different literature sourcesPreparation of exhaustive long range plan (yearly & 5 yearly) listPrepare a Medico- Marketing recommendation reports for new product evaluatedTraining Marketing & Sales TeamPreparing. Training Manua…"
525866645,Front Office Executive,2017-04-04T19:20:03Z,0,"SkillSet: Front Office, Front Office Executive. Handling the reception area. Greet and welcome guests. Answer questions and address complaints Answer all incoming calls and redirect them or keep messages. Receive letters, packages etc. and distribute them. Prepare outgoing mail by drafting correspondence, securing. parcels etc. Monitor office supplies and place orders when necessary Keep updated records and files Monitor office expenses and costs Take up other duties as assigned (travel arrange…"
525866666,Digital Marketing,2017-04-04T19:20:04Z,0,"SkillSet: SEO, SEM, marketing database, email, social media. Plan and execute all web, SEO/SEM, marketing database, email, social media and display advertising campaigns Design, build and maintain our social media presence Measure and report performance of all digital marketing campaigns, and assess against goals (ROI and KPIs)Identify trends and insights, and optimize spend and performance based on the insights Brainstorm new and creative growth strategies Plan, execute, and measure experiment…"
525866675,Computer operator,2017-04-04T19:20:04Z,0,SkillSet: Computer operator. Determines sequence of operations by studying production schedule. Prepares equipment for operations by accessing software in computer; loading paper into printers and plotters; preparing for output. Starts operations by entering commands. Maintains operations by monitoring error and stoppage messages; observing peripheral equipment; entering commands to correct errors and stoppages; reloading paper; making adjustments in process; notifying supervisor for additional…
525866662,Front Office Executive,2017-04-04T19:20:04Z,0,"SkillSet: Strong communication, people skills. Greet and welcome guests Answer questions and address complaints Answer all incoming calls and redirect them or keep messages Receive letters, packages etc. and distribute them Prepare outgoing mail by drafting correspondence, securing parcels etc. Check, sort and forward emails Monitor office supplies and place orders when necessary Keep updated records and files Monitor office expenses and costs Take up other duties as assigned (travel arrangemen…"
525866707,Front Desk Cum Admin Executive,2017-04-04T19:20:07Z,0,"SkillSet: Executive Assistant, Front Office, Data Entry. Maintaining decorum of the reception area. Maintaining complete professionalism while dealing with everyone. To prepare, maintain and circulate telephone nos., birthday calendars at PAN India level. Maintaining purchase records viz. e-mail requisitions. Periodical monitoring of office utilities with assistance from AMC providers & ISO process. Inspection / approval of purchase material by physical verification. Ensuring internal communica…"
525866765,Officer - Marketing,2017-04-04T19:20:08Z,0,"SkillSet: marketing, business development. Who can bring the new clients for Ad (Space selling) Mainly focus on new client acquisition."
525866752,Business Analyst,2017-04-04T19:20:09Z,0,"SkillSet: Internet Marketing, online marketing skills. Business Analyst should have experience of bidding on Elance. Looking for Business Analyst who should possess the following skills kindly go through it and let me know further. Business Analyst- JD of Business Analyst: Looking for Internet Marketing Manager with great online marketing skills. Ideal candidate should have atleast 1 year or more experience in online Internet marketing or atleast should have an adequate knowledge about it. The …"
525866771,Receptionist,2017-04-04T19:20:11Z,0,"SkillSet: receptionist, good communication skills. Managing the front office area of the renowned Salon of the city -Attending walk - in clients.-Managing appointments over the phone -Prepare periodical reports-Good Communication in English -Good in basic Computers. -Female Candidates Only -A young and dynamic female graduate having 1-3 years experience in similar industry. -Should have experience of team work."
525866803,Proof Reader,2017-04-04T19:20:12Z,0,"SkillSet: Proofread, edit, review translated files. The Project Coordinator-Quality Check is responsible for reviewing and proofreading of translated documents to ensure that the translation adheres to a specific set of language standards and established guidelines. This position will report to the Team Lead-Quality Check. Duties & Responsibilities Proofread, edit and review translated files and other content. Analyze and assess projects and project-related files. Develop expertise for industry…"
525866801,Senior Merchandiser,2017-04-04T19:20:12Z,0,"SkillSet: Merch, iser, good communication skills. Senior Merchandiser ELIGIBILITY CRITERIA: Education: Any Degree Experience: 10 - 15 Yrs"
525866789,Marketing Executive,2017-04-04T19:20:12Z,0,"SkillSet: marketing, business development. Marketing Executive Qualification: -2 and (Graduates also apply for job) Experience: - Fresher"
525866832,"SEO Analyst,",2017-04-04T19:20:14Z,0,"SkillSet: SEO, internet marketing. Provide SEO consultation - Execute Search Engine Optimization Tasks which includes Complete site Audit, Mobile responsive checks, XML Sitemaps, Crawl errors, Competitor Analysis.Perform keyword research to optimize existing marketing objectives"
525866839,MARKETING EXECUTIVE,2017-04-04T19:20:15Z,0,"SkillSet: Marketing Management, Marketing Manager, Marketing, Marketing Strategy, Marketing. Marketing Executive Reporting to : Senior Manager Work Location : New Delhi Responsibilities : Marketing work Visiting their client to introduce new products. Relationship building with their client. Another marketing work related Sales supporting work, technical service work Requirements : The experience of Marketing or The experience of visiting the client for sales Desirable Character :"
525866840,MARKETING MANAGER,2017-04-04T19:20:15Z,0,"SkillSet: Marketing Management, Marketing Manager, Marketing, Marketing Strategy, Marketing. Marketing Manager Reporting to : Division Head Work Location : Pune Responsibilities : Marketing policy and planning management and performance management according to management policy Education and management for market staff and PR staff Direction, planning, performance management of web policy Brand ,event plan and performance management for each sales area Budget planning and budget management for …"
525866862,Asst/ Sr Asst/ Textile- Marketing,2017-04-04T19:20:16Z,0,"SkillSet: Marketing Management, Marketing Manager, Marketing, Marketing Strategy, Marketing. The position is for back end profile. Job Requirements: Should have skills of Drafting & Mailing. Good command over MS Excel. Should have knowledge in Reconciliation of Accounts Statement. Good communication skills."
525866877,Marketing Executives,2017-04-04T19:20:17Z,0,"SkillSet: Bd, Business Development, Sales, generating lead, Client Acquisition. Job Description includes: Visiting K10 Schools for Marketing Visits Lead Generation Follow up with Clients on Phone & Mail Sourcing order for range of books from K10 Schools Willing to travel local & outstation."
525866871,Social Media Marketing Executive Films,2017-04-04T19:20:17Z,0,"SkillSet: digital marketing, internet marketing skill. Responsible for creating social media content & distribution to create a best in class marketing function. Collaborate & deliver integrated approach to marketing. Create lifecycle marketing campaigns on film titles across theatrical, new releaseRequirementsDemonstrate dynamism, creative flair and passion for films (Tamil)Prior experience in social media marketing for Tamil filmsCreate Memes for social media & prior memes creation a big plus…"
525866867,Required Male Candidate for Back end Marketing,2017-04-04T19:20:17Z,0,"SkillSet: Marketing Management, Marketing Manager, Marketing, Marketing Strategy, Marketing. Job Requirement: 1. Should have skills of Drafting & Mailing. 2. Good command over MS Excel. 3. Good communication skills."
525866887,Receptionists,2017-04-04T19:20:18Z,0,"SkillSet: Front Office, Receptionist, Front Desk Executive, Front Desk. Must have minimum of 1Yr Experience as a ReceptionistFront Office Executive.  Must be presentable Should have good attitude  Should have good communication skillsWORK LOCATION:- Basavangudi, Bangalore. EXP: 1-3 Years Note:- If the above profile is suitable and if you can join us immediately within 15 days. Request you to revert with your updated cv along with the below details.CCTC & TH:-ECTC & TH:-Notice Period :- RegardsG…"
525866909,CHIEF COORDINATOR/ADMINISTRATOR,2017-04-04T19:20:19Z,0,"SkillSet: Admin, Office Administration, Facility Management, Procurement, Accommodation. Minimum BSc(optom) with 4-5 years academic experience as Faculty / administration. Work experience with Open University shall be an added advantage. CTC: Up to 40K RESPONSIBILITIES: Should be able to work independently towards the day to day administrative activities of the college. Arrange for college timetables for Degree & Diploma, classroom availability, Faculties etc. Work towards upgrading the quality…"
525866907,FRONT OFFICE EXECUTIVE,2017-04-04T19:20:19Z,0,"SkillSet: Front Office, Receptionist, Front Desk Executive, Front Desk. Minimum Graduation or Under Graduate with excellent communication & work experience. Hospital experience shall be an added advantage. CTC : Upto 20K Responsibilities: Handle hospital reception Operate telephones for appointments Book appointments for doctors as per schedule Should have good communication skills Co-ordinate between patients and consultants"
525866968,Marketing Personnel,2017-04-04T19:20:23Z,0,"SkillSet: marketing, business development. Ability to interact with C-Level executives, generate major accounts in the line activity. The candidate should preferably be an MBA from a top University with a min. post qualification experience of 10 years in any of the above areas."
525866985,Merchandiser,2017-04-04T19:20:23Z,0,"SkillSet: Confident, possess good communication skills. The candidate should be from FMCG or Telecom industry, with minimum 6 months of relevant industry experience. Confident and possess good communication skills. Ensures sale through effective representation / display of the product."
525866975,Senior Business Analyst,2017-04-04T19:20:23Z,0,"SkillSet: MapReduce, Pig, Hbase, Hive, JavaMR. Build a data platform that enables the business teams at the client to create the products needed by our clients- Ensuring high quality though out the development process- Collective ownership of a cloud based platform using big data technologies- Actively look for ways to make things better- You have a passion for writing good code- Must be able to articulate benefits of Big Data- HandsSpark is a must have- Java/Scala are great plus- Hands on expe…"
525866974,AVP - Analytics,2017-04-04T19:20:23Z,0,"SkillSet: SAS SQL Data Management, SAS to analyze, solve business problems. Candidate is expected to bring in a consultative mindset and problem solving approach and drive analytical throughput for the team- Experience in SAS SQL Data Management exposure across customer life-cycle is must- Candidate should have excellent communication skills to interact with senior clients- Candidate should have excellent people management skills and must have team lead experience of 10 size team for at least 2…"
525866972,Data Analyst,2017-04-04T19:20:23Z,0,"SkillSet: R, MATLAB, SPSS, CART, C#. Sr. Analyst I-Stat (IITns, CS, Mathematics and Scientific Computing) Responsibilities: - Design and implement mathematical models for fundamental valuation of securities. The person will need to understand latest research in quantitative finance and implement the same. - Design, back-testing and implementation of high-frequency trading strategies on international exchanges. Work as part of the market-making team to determine the signals and trading strategie…"
525866976,Senior Business Analyst- SAS,2017-04-04T19:20:23Z,0,"SkillSet: SAS, Advance SAS. Minimum 4 years of experience as SAS developer with proficient knowledge on Unix environment.Experience in SAS migration projects.- Strong programming skills in Base SAS and Advance SAS.- Should able to Run SAS Base programs/jobs which runs on daily/weekly/monthly basis.- Should able to fix failing jobs due to logic/code issues and able to do jobs modifications based on the requirements.- Should able to analyse the code, understand the purpose, modify the code to run…"
525866984,Merchandiser,2017-04-04T19:20:24Z,0,"SkillSet: Confident, possess good communication skills. The candidate should be from FMCG or Telecom industry, with minimum 6 months of relevant industry experience. Confident and possess good communication skills. Ensures sale through effective representation / display of the product."
525866986,Merchandiser,2017-04-04T19:20:24Z,0,"SkillSet: Confident, possess good communication skills. The candidate should be from FMCG or Telecom industry, with minimum 6 months of relevant industry experience. Confident and possess good communication skills. Ensures sale through effective representation / display of the product."
525866987,Merchandiser,2017-04-04T19:20:24Z,0,"SkillSet: Confident, possess good communication skills. The candidate should be from FMCG or Telecom industry, with minimum 6 months of relevant industry experience. Confident and possess good communication skills. Ensures sale through effective representation / display of the product."
525867040,Public Relations Director,2017-04-04T19:20:27Z,0,"SkillSet: Develop, marketing communications plan. Develop a marketing communications plan including strategy, goals, budget and tactics Develop media relations strategy, seeking high-level placements in print, broadcast and online media Coordinate all public relations activities"
525867051,Senior Manager - Marketing,2017-04-04T19:20:27Z,0,"SkillSet: Marketing Management, Social Media, Marketing campaigns. Build & manage the company's social media profiles. Overseeing the marketing budget. Lead a marketing team which develop & execute new concepts of the organization."
521694701,Regional Manager,2017-03-26T02:15:18Z,0,"SkillSet: Priority, Focus, Ideas, Business Development, Customer Relationship. Managing a team of Area Manager / Marketing Executive2 Responsible for achieving Regional total sales including product-wise targets.3 Providing coaching; guidance and motivating AM/team members so as to develop a high performing team.4 Tracking sales performance, customer coverage, quality of calls and providing feedback for enhancing productivity of the sales team and customer satisfaction.5 Efficient use and deplo…"
521694674,Purchase (Engineering) Executive,2017-03-26T02:15:18Z,0,"SkillSet: Focus, Negotiation, Management. Purchase (Engineering) Executive Location : Kolkata Qualification : Graduate Exp in Local market knowledge essential. Job Description : Purchase- Selection of vendor, Procurement of items, negotiation , market survey, maintain documents Should have bargaining ability Should be able to move into the market Should have knowledge about mechanical & electrical parts Should have knowledge about machinery maintenance Knowledge of vendor development Should be …"
521694776,HIRING FRESHERS FEMALE RECEPTIONIST (KOLKATA),2017-03-26T02:15:23Z,0,"SkillSet: Manufacturing. We have some urgent requirements of FRONT OFFICE EXECUTIVE(FEMALE) Job Responsibility: Handling Entire Front DeskKeeping track of incoming and outgoing courierOffice administration and file maintenancemaintaining appointment schedule and keeping calendar for the managementguest/ visitor handlingPreparing various reports Desired Qualities: Candidate should be having Smart Presentable appearanceGood communication skills in Bengali, Hindi and English Location: -north kolka…"
521694828,"Tele-Calling (Exp-0-6 months) (Loc-Noida,East of Kailash)",2017-03-26T02:15:25Z,0,"SkillSet: ""Calling"" Telecalling"" Telemarketing"" Customer-care""""CSR"" BPO""""KPO""""Travel"". Job title-Telemarketing Executive Salary-8k to 12k huge incentive Loc- Noida, East of Kailash Qualification- Graduate Job Description- Lead Generation Customer retention with new ideas Cold calling Job Responsibilities- Excellent Communication skills Go getter attitude Interest in incentive earnings"
521695007,Scrum Master,2017-03-26T02:15:35Z,0,"SkillSet: Production, Ajax, Management, Scrum, Design. Provide technical leadership to scrum teams Design and write code for web/ mobile HTML5 AJAX applications that scale to high- volume production quality. Engineer a world- class platform with an eye towards rapid iteration and creative problem solving. Prototype creative solutions quickly, and be able to collaborate with others in crafting and implementing your technical vision. Contribute and collaborate in creation and consumption of open,…"
521695006,Application Development Lead,2017-03-26T02:15:35Z,0,"SkillSet: System Testing, Testing, Management, Design. As a Tech Lead, the role will require leading the delivery of key phases and components of the Target State Platform vis-a-vis the CCB Finance Roadmap. The role requires participation in project initiation, application design and code reviews, system testing and rollouts to Finance Users. The Tech Lead will also need to Project Manage the efforts, be a self-managing while also working with peers within the team, and ensure full transparency…"
521695004,Dotnet ( MVC/ Mvc4),2017-03-26T02:15:35Z,0,"SkillSet: SQL Server, JavaScript, C#, Net, Management. DESIRED SKILLS AND EXPERTISE Seasoned Developer in Dot Net and Microsoft technologies. Hands on experience in .Net 4, Javascript , Jquery, MVC4,C#, HTML5, SQL Server 2008[Angular JS will be an added Advantage] Exposure to Telerik Tools will be an advantage Understand business/functional requirements and translate them to technical solutions Highly motivated team player and eager to learn new technologies Should have good oral and written co…"
521695213,India Communications Leader,2017-03-26T02:16:04Z,0,"SkillSet: Foundation, Basic, MULTIPLE, Reports, Corporate Communications. Summary This is an opening for a Communications Leader role, based in Bangalore, India, in the Communications Department within Honeywell Technology Solutions'(HTS) India group. This position reports directly to the global Communications Director of HTS. This position will play a key role in being the communications strategy consultant to the VP/GM of HTS India and the country leadership team. He/She is responsible for ma…"
521695468,SEO Executive,2017-03-26T02:16:27Z,0,"SkillSet: ""Media Marketing"", ""SME"", ""Social Media Marketing"", ""Media Planning"", ""Social Media"". SEO Executive Complete SEO setups for our international clients our own website Good command on English language-reading writing Experience in Off-Page Optimization knowledge of On-Page Optimization Familiar with Article, directory, social bookmarking, blog forum Keywords: Digital Marketing, seo, web marketing, Internet Marketing, Email Marketing, ppc, Google Adwords, Social Media Marketing, social m…"
521695512,Walk in Interview For Seo Executive,2017-03-26T02:16:30Z,0,"Dear Aspirants, Greeting from Digital Vision Technology Pvt. Ltd, a Google partner firm. Make a mark on your very first job opportunity Hit a six off the first ball get noticed and create an impact as a fresher About Us:- Digital Vision Technology Pvt.Ltd a Google Partner Firm (DVTPL) is an innovative digital marketing agency which believes in making themselves as a stop shop for any business to strengthen its roots in the digital universe. Our wide range of web solutions includes PPC, Search E…"
521695593,Marketing Manager,2017-03-26T02:16:31Z,0,"SkillSet: ""Marketing Management"", ""Advertising Management"", Market Research, Advertising, Marketing. A key contributor to the marketing team, this individual needs a strong understanding of sales and marketing in the global environment. This position will work with all aspects of marketing including market research, sales, order, agreements, documentation of export, dispatch, and advertising, to handle form the order to dispatch till received. Modern trade Chain Appointment and Management, Merc…"
521695713,Executive - Business Development,2017-03-26T02:16:36Z,0,"SkillSet: ""BDE"", ""business development"", ""marketing"", ""telecalling"", ""Communication Skills"". Roles Responsibilities: Attracts potential customers by answering product and service questions and suggesting information about other products and services. Recording and updating clients information into the database. Recommends potential products or services to management by collecting customer information and analyzing customer needs. Managing inbound, outbound and chat process. Generate sales leads…"
521695715,Executive - Business Development,2017-03-26T02:16:37Z,0,"SkillSet: ""BDE"", ""business development"", ""marketing"", ""telecalling"", ""Communication Skills"". Roles Responsibilities: Contact, coordinate follow-up with the perspective clients Briefing them about the company, our products the services. Arranging appointments with the interested clients. Benefits: Chance to learn about retail loans. Get to know the process of file preparation and its drafting Complete knowledge of loan cycle from customer's point of view Chance to learn about the various kind of…"
521695692,"Guest Relationship Executive (Female )-Mumbai , Chennai and Bangalore",2017-03-26T02:16:37Z,0,"SkillSet: ""Front Office"", ""Guest Relationship Executive"", ""GRE"", guest relations. HIRING girls for 5 star hotels in DELHI, Mumbai, Chennai, Banglore DESIGNATION- guest relation executive (GRE) Responcibilities of GRE Welcome guests during check-in and giving a found farewell to guest while checkout. Handling guest complaints and concerns in an efficient and timely manner. Overseeing VIP guests, arrivals and departures. Detailed information regarding arrivals and room requirements. Have up to da…"
521695806,SEO Executive,2017-03-26T02:16:40Z,0,"SkillSet: ""Media Marketing"", ""SME"", ""Social Media Marketing"", ""Media Planning"", ""Social Media"". SEO Executive Complete SEO setups for our international clients our own website Good command on English language-reading writing Experience in Off-Page Optimization knowledge of On-Page Optimization Familiar with Article, directory, social bookmarking, blog forum Keywords: Digital Marketing, seo, web marketing, Internet Marketing, Email Marketing, ppc, Google Adwords, Social Media Marketing, social m…"
521695807,SEO Executive,2017-03-26T02:16:40Z,0,"SkillSet: ""Media Marketing"", ""SME"", ""Social Media Marketing"", ""Media Planning"", ""Social Media"". SEO Executive Complete SEO setups for our international clients our own website Good command on English language-reading writing Experience in Off-Page Optimization knowledge of On-Page Optimization Familiar with Article, directory, social bookmarking, blog forum Keywords: Digital Marketing, seo, web marketing, Internet Marketing, Email Marketing, ppc, Google Adwords, Social Media Marketing, social m…"
